fianco a fianco;;a;fianco;o la conquista araba del 661 : quando musulmani e cristiani poterono pregare ,  fianco a fianco , intorno_alla testa del Battista . Oggi sono l ' immigrazione musulmana in Eur;;;;;
fianco a fianco;;a;fianco;gli abissi più profondi del cosmo , coabitava con loro da tempi immemorabili ,  fianco a fianco ( per così dire ) , e ora chiedeva di essere riconosciuta e di poter intraprend;;;;;
fianco a fianco;;a;fianco;a . Poi , per caso , ci siamo alzati nello stesso momento . Ci siamo ritrovati  fianco a fianco davanti_al bancone , aspettando che il barista riempisse di nuovo i nostri bicc;;;;;
fianco a fianco;;a;fianco;"empito dell ' impegno sociale . Egocentrismo e militanza procedevano insieme ,  fianco a fianco , legati da un filo di fiabe e memorie d ' infanzia . "" Zio Nonno mi parlava sp";;;;;
fianco a fianco;;a;fianco;alterni , capitani giustiziati in loco dalla truppa con cui avevano combattuto  fianco a fianco per anni , tenenti trucidati a colpi di baionetta dalle loro stesse squadre . Q;;;;;
fianco a fianco;;a;fianco;"ni molto spinta ; una giovane suffragetta in blue jeans e maglione a girocollo  fianco a fianco con una signora in abito da sera lungo e scollato fino_all ' ombelico ... E dap";;;;;
fianco a fianco;;a;fianco;boschi autunnali . Per la strada bianca , battuta dal sole , avanzavano i due  fianco a fianco . Giovanni e Francesco erano amici , vissuti insieme per lunghi anni , con le s;;;;;
fianco a fianco;;a;fianco;"ati alla esistenza comune , alle gioie della solita gente , al medio destino ;  fianco a fianco vivevano con la uguale speranza , senza mai farne parola , perché non se ne ren";;;;;
fianco a fianco;;a;fianco;d ' una banalità rivoltante , da grattacielo . Ho vicino Giovanni , camminiamo  fianco a fianco , avanti a noi Catullo Camilli imprime poesia , idealmente , alla prosa delle c;;;;;
fianco a fianco;;a;fianco;attutto dove . Dove le aveva viste per la prima volta , dove avevano camminato  fianco a fianco , dove si erano fermati , dove era successo quello che era successo , dove le a;;;;;
fianco a fianco;;a;fianco;pagnai in aeroporto trascinando i bagagli . Durante il percorso non parlammo ,  fianco a fianco , ma ci guardavamo riflessi nel vetro del vagone , sdoppiati dalle proiezioni s;;;;;
Fianco a fianco;;a;fianco;edale . Potrebbe avere una commozione cerebrale . » Margot e Franca Gherardi .  Fianco a fianco . Era la prima volta che Margot si trovava a sfiorare una delle altre amanti di;;;;;
fianco a fianco;;a;fianco;i e molti sono stati te . Sí , la differenza è minima . Ci sediamo sui gradini  fianco a fianco , quasi istintivamente raccolgo un legnetto e mi metto a intagliarlo col temper;;;;;
fianco a fianco;;a;fianco;.. Ha proprio ragione questo frate missionario , a dire che la fede va vissuta  fianco a fianco coi poveri , i derelitti , gli emarginati , tutta questa zente che per fortuna;;;;;
fianco a fianco;;a;fianco;mpo di un baleno , quando si scontravano . Finimmo così col trovarci un ' alba  fianco a fianco di_fronte_allo stesso primo sbieco raggio di sole , senza più un pretesto che c;;;;;
fianco a fianco;;a;fianco;aro , se la stringe in vita Si abbassa a guardare le decine di scarpe disposte  fianco a fianco in uno scomparto traversato da un tubo d ' ottone . Ne pesca un paio viola dal;;;;;
Fianco a fianco;;a;fianco;", e nello stesso momento è già finito . Macno si gira ; Liza si gira con lui .  Fianco a fianco guardano il palazzo : le grandi finestre che trattengono luci e suoni e movimen";;;;;
fianco a fianco;;a;fianco;Corrono lungo i contorni del laghetto dove nuotano anitre e oche selvatiche :  fianco a fianco senza guardarsi , impegnati in modo diverso a mantenere la stessa cadenza Ted d;;;;;
fianco a fianco;;a;fianco;"due lontre : in lungo per la vasca e indietro seguendone i contorni ondulati ;  fianco a fianco raso al fondo a occhi aperti . Si guardano mentre salgono a prendere aria , sof";;;;;
fianco a fianco;;a;fianco;ine e i taxi e gli autobus accelerano in curve larghe . Liza e Macno camminano  fianco a fianco nella notte che sta diventando umida e rumorosa Poi Macno si ferma e dice Perch;;;;;
fianco a fianco;;a;fianco;"un braccio ; le dice in un orecchio Vieni che ti presento qualcuno . Camminano  fianco a fianco sul pavimanto di legno ben stagionato e cerato . Gli ospiti li osservano obliqu";;;;;
fianco a fianco;;a;fianco;a guida rapido per la strada che scende verso la città Liza e Ted stanno zitti  fianco a fianco , sudati sul sedile di plastica appiccicaticcia Respirano l ' aria calda che en;;;;;
fianco a fianco;;a;fianco;re un modo diverso per farlo . 16 . Un tempo , quando la domenica percorrevano  fianco a fianco le strade di Città Alta per andare a messa , una lunga e possente , l ' altra p;;;;;
fianco a fianco;;a;fianco;lessandro appariva su un ' insellatura della collina . Avanzavano tutti e otto  fianco a fianco e i raggi del sole che avevano alle spalle li avvolgevano in un alone di luce p;;;;;
fianco a fianco;;a;fianco;Ferito , e ... E dietro il Soldato Ferito venivano due Tasso , che camminavano  fianco a fianco vestite in divisa russa , col cinturone pesante , i capelli lunghi , i grandi o;;;;;
fianco a fianco;;a;fianco;di individui , come lei , a cui non è mai stato detto nulla , che sono vissuti  fianco a fianco con gli esseri umani , ritenendosi essi stessi umani . Quanto_alla sua mano ...;;;;;
fianco a fianco;;a;fianco;arete insieme per sempre» . Il Rajah li abbigliò con i vestiti reali e li mise  fianco a fianco in una bara . Vennero officiati i riti reali del seppellimento mentre la bara v;;;;;
fianco a fianco;;a;fianco;"lo sul lato sinistro del viso . Scosse il capo , rifiutando il malessere . E ,  fianco a fianco , essi proseguirono , tra le tombe . "" Dov ' è che facciamo il picnic ? "" doman";;;;;
fianco a fianco;;a;fianco;"ai un ' occhiata qui ! "" gridavano eccitati . I milioni di ricordi giacevano ,  fianco a fianco , allineati e compressi come sardine in scatola . Archiviati in ordine cronolog";;;;;
fianco a fianco;;a;fianco;i speroni di José graffiarono e ferirono i fianchi del suo gran cavallo nero e  fianco a fianco i due animali si slanciarono lungo la strada del villaggio . L ' americano udì;;;;;
fianco a fianco;;a;fianco;à folle , ma l ' americano gli parlò in tono severo . Mentre i due procedevano  fianco a fianco , il piccolo cavallo di Richardson spinse il morbido muso in avanti , incuriosi;;;;;
fianco a fianco;;a;fianco;ti di aver fatto la scelta più logica . Scelsi lui e cominciammo a camminare ,  fianco a fianco . Il fatto che per gli esseri umani non esista una stagione dell ' accoppiament;;;;;
fianco a fianco;;a;fianco;anche i nostri interessi erano diversi . C ' era soltanto , nel camminare così  fianco a fianco , quella sensazione di essere avvolta da qualcosa ... era soltanto questo . L ';;;;;
fianco a fianco;;a;fianco;"dopo , le parole tra noi si diradarono . Sembrava strano trovarci a camminare  fianco a fianco in questa strada che per noi due avrebbe dovuto essere la strada "" di sempre """;;;;;
fianco a fianco;;a;fianco;na lampada schermata , in attesa . I due ragazzini si erano appena sistemati ,  fianco a fianco sulla pancia , con il mento nelle mani , per guardare , quando la botola nel so;;;;;
fianco a fianco;;a;fianco;agna il prolungato intersecarsi dei problemi pratici di due persone che vivono  fianco a fianco e di come tutto ciò tolga il respiro a un uomo . Del modo in cui tutte le sante;;;;;
fianco a fianco;;a;fianco;mente : era stato mio collega , per un anno intero avevamo avuto le scrivanie  fianco a fianco nello stesso ufficio . Ora mi riterrà anche lui superba . Ma questa lagnanza fu;;;;;
fianco a fianco;;a;fianco;llora poterono parlare degli ultimi momenti di Juan José . I genitori , seduti  fianco a fianco sull ' orribile sofà color rubino , tenendosi per mano per la prima volta davan;;;;;
fianco a fianco;;a;fianco;un paio di sacchi a pelo per la notte quando non trovava una stanza . Andavano  fianco a fianco , come due soci , Dai la aiutava a portare parte delle cose e a preparare il ba;;;;;
fianco a fianco;;a;fianco;". "" Ma Emmanuelle recalcitrava . Inoltre non aveva alcuna voglia di ritrovarsi  fianco a fianco col suo vicino di cabina . Lo scalo le sembrò noioso . A_che serve sapere che c";;;;;
fianco a fianco;;a;fianco;le , di penetrarla così profondamente , di godere talmente . Restano allungati  fianco a fianco , le spalle e i fianchi che si toccano . Emmanuelle non si muove , perché nessu;;;;;
fianco a fianco;;a;fianco;zze s ' arrampicarono su per gli otto metri di scala e si sdraiarono bocconi ,  fianco a fianco , sul tappeto di corda che copriva la piattaforma . Ariane si liberò rapidament;;;;;
fianco a fianco;;a;fianco;, vero , mammina ? » « Sì . » Era ansiosa di confortarmi . Dopo esserci sedute  fianco a fianco sul divano , mi chiese : « Ti sarebbe di aiuto raccontarmi tutto ? » Mi sforzai;;;;;
fianco a fianco;;a;fianco;e da fare . » Fuori nel giardino i due giovani stavano dietro i bambù . Seduti  fianco a fianco su un sedile rustico si tenevano stretti . « Tu sai che non puoi sposare altri;;;;;
fianco a fianco;;a;fianco;sersi versata un drink si sedette di_fronte_a Trainer e Draegler , che stavano  fianco a fianco sul divano . « Okay » iniziò Karen con un sospiro , « ditemi com ' è andata . »;;;;;
fianco a fianco;;a;fianco;er , digitando sulla tastiera del computer . « Molto meglio . » Eravamo seduti  fianco a fianco di_fronte_allo schermo da diciannove pollici . Entrambe le foto erano sullo sca;;;;;
fianco a fianco;;a;fianco;venne praticamente spostato di peso , col consigliere dal cuore arido che finì  fianco a fianco col signor Goljadkin . Fu lui a prenderlo sotto braccio e a farlo sedere accant;;;;;
fianco a fianco;;a;fianco;eva . Mai , nemmeno quando papà ci faceva le foto . Dovevamo metterci in piedi  fianco a fianco , davanti_a mamma . Era sempre lo stesso : papà si allontanava di qualche passo;;;;;
fianco a fianco;;a;fianco;"rmi a sedere lì nel buio ma lo feci ; ci sedemmo stretti l ' uno all ' altro ,  fianco a fianco . Riuscivo a vedere la sagoma di Kevin , la sua testa che si muoveva . Vedevo c";;;;;
fianco a fianco;;a;fianco;"ei suoi occhi . Non splendevano . Quando Liam e Aidan erano insieme , in piedi  fianco a fianco , era facile vederli come li vedevamo sempre ; piccoli , buffi , tristi . Erano";;;;;
fianco a fianco;;a;fianco;i giungere in ritardo ad un appuntamento . Franco e Roberto stavano camminando  fianco a fianco , con gli occhi sul sentiero per non inciampare : i rami fitti non lasciavano p;;;;;
fianco a fianco;;a;fianco;mparse gli dessero ragione contro la giovinetta o contro_di me ... Camminavamo  fianco a fianco ... Inutilmente cercavo di sviare la tristezza che ci raggiungeva tutti e tre .;;;;;
fianco a fianco;;a;fianco;i chiama desiderio . Se solo ci fossero stati altri uomini con i quali lottare  fianco a fianco ! Ma i più erano là , là a glorificare il mostro , l ' idolo . Alcuni si salvav;;;;;
fianco a fianco;;a;fianco;o che quello era accaduto molto tempo prima , adesso i miei genitori dormivano  fianco a fianco nella camera , quieti e puri come i morti nella Tomba . Ma - e i ventri scoppia;;;;;
fianco a fianco;;a;fianco;Un ristorante notturno , in place de l ' Opera . Melomani e prostitute stavano  fianco a fianco . Sapevo chi avevo voglia di vedere . Ed era lì . Marie - Lou , una giovane put;;;;;
fianco a fianco;;a;fianco;o in silenzio verso il salotto . Charlie Slatter e il sergente Denham rimasero  fianco a fianco come due giudici , come_se avessero assunto di proposito quella posizione . Di_;;;;;
fianco a fianco;;a;fianco;gli era imbevuto . Charlie Slatter lo capiva meglio di chiunque altro . Ancora  fianco a fianco , come_se un solo impulso , un solo rimorso , un ' unica paura li muovesse , i;;;;;
fianco a fianco;;a;fianco;a che si moltiplicava rapidamente , e nella quale i gerani sarebbero cresciuti  fianco a fianco con le erbe selvatiche . Un ramo si sarebbe fatto strada fra i vetri rotti dell;;;;;
fianco a fianco;;a;fianco;ra ... vedo che sta uscendo il sole . » « Così possiamo continuare a camminare  fianco a fianco , come abbiamo fatto tutta la vita . L ' unica differenza è che devo appoggiarm;;;;;
fianco a fianco;;a;fianco;enti , aveva seguito il suo consiglio . Mentre stavano attraversando la strada  fianco a fianco Garrett allungò il braccio per prendere dalle mani di Whitney la borsa termica;;;;;
fianco a fianco;;a;fianco;! Qui , non aspettarti alcun appoggio , alcuna protezione . Gli uomini vivono  fianco a fianco , è tutto . Tra loro , nient ' altro che i soldi : parentela , amicizia , amore;;;;;
fianco a fianco;;a;fianco;essere pesante da portare un bagaglio così . Lui e il bigliettaio ci piazzano  fianco a fianco su un sedile , ci danno i biglietti poi scendono . Vanno verso la nonnetta e la;;;;;
fianco a fianco;;a;fianco;mo per la Rua dos Fanqueiros . Era un bel pomeriggio d ' autunno . Camminavamo  fianco a fianco , entrambi in silenzio e , in_fondo_alla strada , seguendo l ' indicazione di Q;;;;;
fianco a fianco;;a;fianco;scala , che era abbastanza larga perché cinquanta uomini potessero camminarvi  fianco a fianco . Sulle pareti i murali , sbiaditi e crepati , erano ancora tanto vivi e squisi;;;;;
fianco a fianco;;a;fianco;lungo da permettere a Caramon di affiancarglisi . Poi si mossero lentamente ,  fianco a fianco , in_mezzo_all ' acqua tumultuosa , saggiando ogni singolo passo , poiché il fo;;;;;
fianco a fianco;;a;fianco;arebbe morto . Provò anche pietà per i cannoni , per quei buoni compagni ritti  fianco a fianco in balda fila . Vide una brigata che muoveva in aiuto dei reparti messi a dura;;;;;
fianco a fianco;;a;fianco;mico , esultante e acclamato , impugnando con vanità il suo tesoro . Sedettero  fianco a fianco , congratulandosi a vicenda . XXIV I rombi che si erano diffusi in lunga linea;;;;;
fianco a fianco;;a;fianco;nessuno sembrava strano che un maggiore e un sergente potessero gozzovigliare  fianco a fianco . La disciplina che aveva portato gli israeliani al_di_là_del Sinai scaturiva d;;;;;
fianco a fianco;;a;fianco;desso stavo scoprendo che riguardare i video porno che avevamo visto insieme ,  fianco a fianco sul nostro letto di New York , leniva il dolore della sua turgida e infiammata;;;;;
fianco a fianco;;a;fianco;nali dell ' Impero . Gli unici ad assimilarsi , fin_dai tempi in cui lottarono  fianco a fianco con i patrioti magiari nella guerra di indipendenza del 1848-49 , furono i citt;;;;;
fianco a fianco;;a;fianco;"li esseri umani ; questa verità disperata la compresi allora , mentre sedevamo  fianco a fianco sulla panchina di pietra . Si vive , e nel_frattempo si ripara , si aggiusta ,";;;;;
fianco a fianco;;a;fianco;noravano , eccetto nei momenti in cui il lavoro o i pasti li portavano a stare  fianco a fianco . Di tutti i ragazzi , Kinshi era l ' unico per il quale Jiro provasse rispetto;;;;;
fianco a fianco;;a;fianco;di città , contadino e bovaro , signor Caio e signora Sempronio , eccoli là ,  fianco a fianco sulle lastre di granito delle sue fotografie , orbati delle loro frontiere , re;;;;;
fianco a fianco;;a;fianco;ata . Sono Sergej , Victor , Piotr e Shura . Sergej e Piotr camminano dietro ,  fianco a fianco . Si sono raccontati le esperienze che hanno vissuto . Shura adesso sa che è st;;;;;
fianco a fianco;;a;fianco;passo verso_di lui , il ragazzino entrò nel prato e le andò vicino . Ora erano  fianco a fianco , in_mezzo_all ' erba polverosa . Nanni avrebbe voluto allontanarsi da Erich in;;;;;
fianco a fianco;;a;fianco;o Rita apprese , in realtà , chi fosse la gente con cui aveva vissuto per anni  fianco a fianco nella noiosa cittadina , e allietava Manfred , la sera , col racconto dei singo;;;;;
fianco a fianco;;a;fianco;i prendersi gioco dei ragazzi , e di portarseli sulla spiaggia a passeggiare ,  fianco a fianco . La frequenza con cui li cambiava , però , era altissima , tanto_che se non fo;;;;;
fianco a fianco;;a;fianco;un cielo di scintille talmente sfavillanti da far mancare il fiato . Nuotando  fianco a fianco , ci dirigemmo verso le boe . L ' indomani mattina avrebbe preso lo Schinkansen;;;;;
Fianco a fianco;;a;fianco;sola in una torma di uomini pronti a tutto , proprio come era stato in Texas .  Fianco a fianco , i quattro Janis , Gurley , Getz e Andrew - se ne andavano a zonzo per Haight;;;;;
fianco a fianco;;a;fianco;insegnante di turno . Nell ' ultima fila , nell ' angolo più quieto , sedevano  fianco a fianco Charlotte ed Emily , così assorte nello studio da non percepire alcun rumore o;;;;;
fianco a fianco;;a;fianco;ltima conferenza di Thackeray . E ' stato interessante mettere i due documenti  fianco a fianco , studiare il duplice aspetto di cui sono l ' espressione , inquadrare , altern;;;;;
fianco a fianco;;a;fianco;rigeni sul marciapiede , poi gli fece attraversare la strada e li lasciò stesi  fianco a fianco su una banchina spartitraffico , a sanguinare sotto gli oleandri rosa mentre i;;;;;
fianco a fianco;;a;fianco;. La prima cosa che dovete sapere è che uomo e donna si sono evoluti insieme ,  fianco a fianco . E questo dimostra che la femmina della razza umana è l ' animale più coraggio;;;;;
fianco a fianco;;a;fianco;sentimento che , congiunto alla discrezione e all ' insofferenza di ritrovarmi  fianco a fianco con l ' esibizionismo dei falsi dolenti , mi tenne lontano ( non certo con il p;;;;;
fianco a fianco;;a;fianco;e la seconda vilota , quella di Cannaregio : Anema mia , quando saremo a lai (  fianco a fianco ) streti se ciaperemo a brazzacolo discoraremo d ' i tempi passai anema mia qua;;;;;
fianco a fianco;;a;fianco;critti e ricopiarne i nomi , per vedere le razze , i popoli che stavano seduti  fianco a fianco nell ' aula , far tintinnare i suoni delle loro lingue , i suffissi patronimici;;;;;
fianco a fianco;;a;fianco;di entrambi e i luoghi desolanti della conversazione . Hanno passato del tempo  fianco a fianco , lavorando o semplicemente consumando insieme le attese , che nel carcere sono;;;;;
fianco a fianco;;a;fianco;divenne noto in seguito come scienza cognitiva , e che vede i filosofi operare  fianco a fianco con scienziati della mente di varia estrazione , in un continuo correlarsi di i;;;;;
fianco a fianco;;a;fianco;tà anche nell ' organizzazione di un convegno che ha visto la partecipazione -  fianco a fianco - di storici , archeologi , ingegneri , chimici , biologi , storici dell ' arte;;;;;
fianco a fianco;;a;fianco;", in particolare con la serata di gala dell ' 8 ottobre 1999 , che ha visto ,  fianco a fianco , i principali "" attori "" del mondo della montagna , e che ha rappresentato qua";;;;;
fianco a fianco;;a;fianco;enienti da tutti i servizi meteorologici delle nazioni alpine e hanno lavorato  fianco a fianco ricercatori dei paesi partecipanti . Si può dire che mai prima il tempo meteoro;;;;;
fianco a fianco;;a;fianco;i queste iniziative , i due organi si sono trovati in_più occasioni a lavorare  fianco a fianco con un partnerdi prestigio : la Soprintendenza per i Beni Ambientali e Architet;;;;;
fianco a fianco;;a;fianco;e le nuove immagini riprese dal telescopio spaziale , che la rivista presenta  fianco a fianco . Ne emerge un guadagno in nitidezza di circa 3 volte . 09 03 1994 te . Scaffal;;;;;
fianco a fianco;;a;fianco;ssero loro sorelle . Per un certo tempo la prole di entrambe le regine convive  fianco a fianco . Però man_mano_che le vespe residenti muoiono , vengono sostituite dalle figli;;;;;
fianco a fianco;;a;fianco;che avanzate della Fondazione Harvard - Armenise , che ci permette di lavorare  fianco a fianco con i nostri colleghi della facoltà di Medicina di Boston . La seconda applicaz;;;;;
fianco a fianco;;a;fianco;zato i recettori del campo magnetico , che si trovano nella mucosa olfattiva ,  fianco a fianco con le cellule responsabili della percezione degli odori . Al microscopio si è;;;;;
fianco a fianco;;a;fianco;e energia diventa questione di vita o di morte . Nella foresta pluviale vivono  fianco a fianco animali a bassa e ad alta energia . Si vedono spesso scimmie urlatrici appese i;;;;;
fianco a fianco;;a;fianco;onverrà prendere in considerazione il neopaganesimo che è andato sviluppandosi  fianco a fianco con l ' umanesimo , minacciando , nell ' attuale momento storico , di distrugge;;;;;
fianco a fianco;;a;fianco;ro , acciaio , alluminio e vetro . Dopo aver lavorato , vissuto e socializzato  fianco a fianco per secoli , abbiamo avviato un esperimento nuovo e radicale : vivere in un iso;;;;;
fianco a fianco;;a;fianco;verno , dirigenti dell ' azienda corporativi e biologi molecolari che lavorano  fianco a fianco per assicurare la veloce e vantaggiosa introduzione nell ' ambiente di organism;;;;;
fianco a fianco;;a;fianco;maggior numero di esperti nelle scienze dell ' informazione che sta lavorando  fianco a fianco con biologi molecolari per gestire le informazioni genetiche , fa eco all ' opi;;;;;
fianco a fianco;;a;fianco;sono quattro cromatidi e quattro placche cinetocorali , due di esse - situate  fianco a fianco - possono legarsi tra loro e volgersi verso un polo , mentre le altre due sono;;;;;
fianco a fianco;;a;fianco;"essere attivate nelle cortecce somatosensitive topograficamente organizzate ,  fianco a fianco con la rappresentazione in linea degli stati corporei "" presenti "" , per dare u";;;;;
fianco a fianco;;a;fianco;, in Tracia , il padre di Alessandro aveva sistemato , al riparo di bastioni ,  fianco a fianco , alcune famiglie di volontari macedoni , indigeni strappati alla terra o al bo;;;;;
fianco a fianco;;a;fianco;nghi , non pontati , in_grado_di navigare nei due sensi . Essi sono ormeggiati  fianco a fianco e trattenuti in_mezzo_alla corrente da due solidi cavi che vanno da una riva al;;;;;
fianco a fianco;;a;fianco;"mescidato "" e di "" polimorfia "" . Il linguaggio mescidato , che può contenere  fianco a fianco termini dialettali e linguaggio aulico , o distorcere a piacimento suffissi e d";;;;;
fianco a fianco;;a;fianco;ro dei contadini e quello dei pastori che dividevano la stessa terra , vivendo  fianco a fianco in tutto il paese , e la stessa cultura , parlavano la stessa lingua : il bantù;;;;;
fianco a fianco;;a;fianco;difficili primi anni settanta , sotto la pioggia di bombe americane , combatte  fianco a fianco con Pol Pot . Khieu Sampham era molto amico di Hou Youn e Hu Nim , tanto_che di;;;;;
fianco a fianco;;a;fianco;ecolo , soprattutto nel periodo del suo declino . Una ricchezza estrema viveva  fianco a fianco con una povertà estrema . Una combriccola di filosofi speculativi e mondani ign;;;;;
fianco a fianco;;a;fianco;iono due coniugi che a lungo vissero insieme e ora riposano , com ' è giusto ,  fianco a fianco . C ' è un bambino che morì piccolissimo . C ' è una ragazza che raggiunse appe;;;;;
fianco a fianco;;a;fianco;dai due operatori , Rocco Guiducci e Franco Maggi - hanno acquisito lavorando  fianco a fianco aspetta adesso solo altre proposte per rimettersi in moto . Annachiara Valle ED;;;;;
fianco a fianco;;a;fianco;ietro . Il discusso boom del Cepu di Maria Simonetti Sui manifesti troneggiano  fianco a fianco un volto noto e uno sconosciuto . Quello noto è di Alex Del Piero , stella dell;;;;;
fianco a fianco;;a;fianco;vremo impegnarci con la capillare raccolta di fondi , vestiario e medicinali :  fianco a fianco con chiunque è già mobilitato ( Chiese , enti locali , associazioni , volontari;;;;;
fianco a fianco;;a;fianco;"enitori "" . Si comporta come i suoi antenati lupi che erano abituati a dormire  fianco a fianco con i compagni , per proteggersi e scaldarsi . Per evitare che il cucciolo di c";;;;;
fianco a fianco;;a;fianco;"iela Bavestrello . "" Sfiorarsi le labbra al risveglio , dopo una notte passata  fianco a fianco , vuol dire riprendere il filo del rapporto . È un pó come dire : io sono qui e";;;;;
fianco a fianco;;a;fianco;ntilezze e carezze . Per farlo isolatevi da figli , amici e parenti . Sedetevi  fianco a fianco , stringetevi le mani , abbracciatevi . Questi gesti non appartengono solo al l;;;;;
fianco a fianco;;a;fianco;"e , eppure sembrano separate da una grande lontananza ; o , meglio , camminano  fianco a fianco , ma divise da un diaframma che attutisce voci e azioni e rende gli uni fantasm";;;;;
fianco a fianco;;a;fianco;ello nell ' acqua , 1962 , di Roman Polanski ) danzano la loro insoddisfazione  fianco a fianco con la lucida amarezza di Nagisa Oshima , che si afferma con Raccolto crudele d;;;;;
fianco a fianco;;a;fianco;ne , la compresenza ( per me felice e grandemente auspicabile ) di molte etnie  fianco a fianco nelle nostre città pone il problema grave dei diritti di ciascuno a conservare;;;;;
fianco a fianco;;a;fianco;micali . Ma con differenze rilevanti . Soprattutto per la gratuità dello stare  fianco a fianco . Si può stare bene insieme anche_se diversi . Pur non sembrando , anche e sopr;;;;;
fianco a fianco;;a;fianco;"C . S . Lewis "" ci raffiguriamo gli innamorati faccia a faccia , ma gli amici  fianco a fianco "" . L ' amicizia è relazione trascendente gli stessi amici . Essa , nell ' unic";;;;;
fianco a fianco;;a;fianco;anche quest ' ultimo affare andasse in porto , Standa e Gs potrebbero trovarsi  fianco a fianco in un unico polo italo - francese . In attesa di questi nuovi sviluppi in campo;;;;;
fianco a fianco;;a;fianco;o mondiale . E , pur se su posizioni ideologiche diverse , si ritrovano spesso  fianco a fianco nel tentare di raffreddare le iniziative americane . Proprio ieri Cina e Russia;;;;;
fianco a fianco;;a;fianco;utonomia dell ' Arma . Alcuni esprimono disagio nel trovarsi d ' ora in avanti  fianco a fianco con gli agenti . Il senso del profondo malessere e dei contrasti quasi insanabi;;;;;
