bocca a bocca;idiosyncratic;a;bocca;Neppure le mura del carcere possono trattenere le parole del Marchese: la bella lavandaia Madeleine (Kate Winslet) le fa uscire con la biancheria, le ricopia dalle lenzuola del recluso, le trascrive raccogliendo il;bocca a bocca;che, dalla cella dello scrittore, attraversa quelle dei ricoverati di Charenton.;sg;idiosyncratic;nominal
bocca a bocca;idiosyncratic;a;bocca;D'altra parte, quando lenta, ostinata e inesorabile, un'ora prima sfiorava i palazzi, le cupole e i campanili più agili e ariosi del mondo, noi, che da un'altana osservavamo il suo;bocca a bocca;con Palazzo Ducale, San Giorgio Maggiore, la chiesa della Salute, avevamo la netta impressione che la nave fosse Venezia, e che la città senza radici e senza identità fosse invece questa Msc Preziosa, con il suo esotismo omologato, il dominio di un ordine finto aldilàdi ogni misura e di ogni codice, il triangolo delle Bermude delle identità perdute delle città del mondo ormai alla deriva, il luccicante spazio - spazzatura inventato dall'architetto Koolhaas che proprio quest'anno dirigerà la Biennale: 140mila tonnellate di junkspace, 68 metri d'altezza, 4.345 passeggeri, 1.751 cabine, 97 suite con maggiordomo personale in tight e guanti bianchi, il teatro Platinum con 1.600 posti, 4 piscine, 12 jacuzzi, 9 ristoranti (uno Eataly) e 26 ascensori per portare Astolfo sulla Luna.;sg;idiosyncratic;nominal
bocca a bocca;idiosyncratic;a;bocca;Dopo quel;bocca a bocca;estenuante per rianimare Tom, uno che prende vita per conto suo.;sg;idiosyncratic;nominal
CORPO A CORPO;idiosyncratic;a;corpo;BOXE , ancora 23 secondi alla fine di questo drammatico terzo round , Poreda cerca di costringere Lawyer alle corde , Lawyer indietreggia , lavora con le gambe , usa il jab per tenere lontano Poreda , 18 secondi , POREDA AVANTI , Lawyer sguscia via sulla sinistra , MA BARCOLLA , POREDA GLI E ADDOSSO , COLPISCE COL DESTRO , A SEGNO , ANCORA CON UN DESTRO AL VOLTO , LAWYER VA IN CLINCH , SEMBRA ESAUSTO , POREDA NON MOLLA , CERCA LO SPIRAGLIO GIUSTO , LAWYER PROVA A REAGIRE , DESTRO SINISTRO , NON VA A BERSAGLIO , ANCORA DESTRO , COLPO SOTTO LA CINTURA , POREDA PROTESTA , L'ARBITRO FERMA L'AZIONE , AMMONIZIONE A LAWYER , 5 SECONDI , POREDA COME UNA FURIA SU LAWYER , è un;corpo a corpo;FURIBONDO , GONG ED E LA CAMPANA CHE TOGLIE LAWYER DA UNA SITUAZIONE non certo comoda , dopo l ' atterramento che ... Respira .;sg;idiosyncratic;nominal
corpo a corpo;idiosyncratic;a;corpo;"Pronte al primo ballo di gruppo della giornata, si ancheggia sulle note di ""Bella ciao"" versione rap con un occhio malizioso al gruppo di ragazzotti, tutti muscoli e tatuaggi, impegnati qualche metro più in là in una serie di";corpo a corpo;dietro un Supersantos nuovo fiammante.;sg;idiosyncratic;nominal
corpo a corpo;idiosyncratic;a;corpo;La ragazza stava cercando a fatica di chiudere un panciuto borsone, appoggiandovisi con tutto il suo peso, in una specie di;corpo a corpo;dall'esito incerto.;sg;idiosyncratic;nominal
corpo a corpo;idiosyncratic;a;corpo;Che errore accettare il duello rusticano imposto dall'Atletico, farsi irretire poco alla volta da quella saga di marcature feroci, di;corpo a corpo;ininterrotti, di gomiti alti dall'una e dall'altra parte.;sg;idiosyncratic;nominal
corpo a corpo;idiosyncratic;a;corpo;«Ti ha mai detto qualcosa mentre eravate in;corpo a corpo;»?;sg;idiosyncratic;nominal
corpo a corpo;idiosyncratic;a;corpo;Sì, sono stato ferito di spada in;corpo a corpo;.;sg;idiosyncratic;nominal
corpo a corpo;idiosyncratic;a;corpo;"Un'energia creativa e corporale che, secondo il critico, trova una corrispondenza, al di là dell'oceano, con l'avanguardia dell'Action Painting proclamata da Jackson Pollock: ""Lì il pittore si dislocava intorno alla tela per intervenire in una sorta di";corpo a corpo;", sviluppando un linguaggio pittorico frutto di un'azione irruenta, veloce, dinamica"".";sg;idiosyncratic;nominal
corpo a corpo;idiosyncratic;a;corpo;Capaci di sopravvivere con l'espediente, di lottare nel;corpo a corpo;o di utilizzare semplici magie, vennero radunati in un'unica congregazione, creata dal bardo Jienn, con sede a Jensys.;sg;idiosyncratic;nominal
corpo a corpo;idiosyncratic;a;corpo;È valido solo nel ;corpo a corpo;.;sg;idiosyncratic;nominal
corpo a corpo;idiosyncratic;a;corpo;STILE è lo stile di combattimento attualmente adottato nel;corpo a corpo;.;sg;idiosyncratic;nominal
corpo a corpo;idiosyncratic;a;corpo;Gli unni però, perso il vantaggio della forza d'urto della cavalleria, si videro imprigionati in un;corpo a corpo;che premiava la pesantezza dell'equipaggiamento difensivo e offensivo romano.;sg;idiosyncratic;nominal
corpo a corpo;idiosyncratic;a;corpo;"Per far ciò si può scegliere fra tre classi di personaggi: il guerriero, il mago e il ""rogue"" (che in italiano potremmo tradurre alla larga con ""furfante""), ognuno con i suoi punti di forza e le sue debolezze (il guerriero è forte nel";corpo a corpo;, ma se la cava male con la magia, il rogue preferisce le armi da lancio ecc).;sg;idiosyncratic;nominal
corpo a corpo;idiosyncratic;a;corpo;È il carattere di questa fine secolo: un;corpo a corpo;tra universalismo e tribalismo.;sg;idiosyncratic;nominal
corpo a corpo;idiosyncratic;a;corpo;In un vicolo di qualche slum del Terzo Mondo potrebbe nascondersi un gigante abbastanza robusto da batterlo in un;corpo a corpo;, il miglior lottatore del pianeta potrebbe magari resistere ai suoi colpi abbastanza a lungo da immobilizzarlo e un esperto in arti marziali di qualche remota palestra sarebbe forse ingradodi sorprenderlo con mosse impreviste.;sg;idiosyncratic;nominal
corpo a corpo;idiosyncratic;a;corpo;Di tutti i sensi l'olfatto è forse il più intransigente e il naso può diventare decisivo in quel;corpo a corpo;che è, in definitiva, l'atto sessuale.;sg;idiosyncratic;nominal
corpo a corpo;idiosyncratic;a;corpo;E certamente, in ogni caso, da questo contatto ne esci con una dignità consolidata, con una consapevolezza che ancora non possedevi, con una voglia e una volontà accresciute, e nuove armi, insomma, nuove munizioni per l'esercizio di quel difficile mestiere, per quell'autentico;corpo a corpo;con se stessi che è la scrittura.;sg;idiosyncratic;nominal
corpo a corpo;idiosyncratic;a;corpo;E il confronto è sviluppato su tutte le distanze: corta (nel;corpo a corpo;), media (gomiti e ginocchia) e lunga (colpi con braccia e gambe).;sg;idiosyncratic;nominal
corpo a corpo;idiosyncratic;a;corpo;Subire il;corpo a corpo; con un tempo di lavoro che quotidianamente insidia e invade il tempo di vita, con uno spazio che si fa liquido e mutevole non più definito dagli stabili confini della fabbrica.;sg;idiosyncratic;nominal
corpo a corpo;idiosyncratic;a;corpo;Animati da una energia psichica e creativa nuova, in un;corpo a corpo;, questi fotografi sviluppano immagini nuove, frutto di sopraffazioni, persecuzioni, raggiramenti, compiuti in movimento, di corsa o a cavallo della moto, durante le ronde notturne.;sg;idiosyncratic;nominal
corpo a corpo;idiosyncratic;a;corpo;Più in generale, dunque, assisteremo a un;corpo a corpo;tra computer - sottiletta e telefonini - cervellone, entrambi in lotta per aggiudicarsi il primato come apparecchio elettronico di riferimento.;sg;idiosyncratic;nominal
corpo a corpo;idiosyncratic;a;corpo;Qualcuno prevede che farà un buco nell'acqua e si troverà impantanato in un;corpo a corpo;con i partiti ulivisti.;sg;idiosyncratic;nominal
corpo a corpo;idiosyncratic;a;corpo;"Sotto quel sole ""invisibile, freddo, calvinista ed eretico"" è tutto uno scintillare di picche, lance, moschetti, morioni, archibugi; le battaglie sono polvere, onore, sangue,";corpo a corpo;", dolore e destino; e l'avventura è l'avventura, come sempre in Pérez - Reverte.";sg;idiosyncratic;nominal
corpo a corpo;idiosyncratic;a;corpo;Mi piacciono tutti e quattro, ma la sensazione del primo... Il;corpo a corpo;con Nesta, un confronto dal quale esco vincitore: bellissimo.;sg;idiosyncratic;nominal
corpo a corpo;idiosyncratic;a;corpo;Quella del regista cinematografico interpretato da Ennio Fantastichini, impegnato nel;corpo a corpo;"con il proprio ""demone"" che, giunto egli al centro anagrafico e professionale della vita, non gli dà pace.";sg;idiosyncratic;nominal
corpo a corpo;idiosyncratic;a;corpo;Cerca il;corpo a corpo;con Del Piero, fatica, ma ottiene spesso buoni risultati.;sg;idiosyncratic;nominal
corpo a corpo;idiosyncratic;a;corpo;Si è barricato nel suo tugurio, impegnato in un interminabile;corpo a corpo;con la suscettibile divinità cibernetica.;sg;idiosyncratic;nominal
corpo a corpo;idiosyncratic;a;corpo;Particolarmente dotati come uccisori, più utili dei cecchini perché quanto imbattibili nei;corpo a corpo;"e nei combattimenti casa per casa, spesso uccidevano in modo crudele, lui ad esempio era noto in quella zona del fronte di Stalingrado con l'appellativo di ""Sergente Mannaia'', inquanto questa era la sua arma preferita, strumento pratico e utilissimo quando nell'attaccare le trincee nemiche occorreva combattere all'arma bianca.";sg;idiosyncratic;nominal
corpo a corpo;idiosyncratic;a;corpo;Al fuoco della pistola, Fortunato preferì il;corpo a corpo;.;sg;idiosyncratic;nominal
corpo a corpo;idiosyncratic;a;corpo;E una volta messe in chiaro le cose lì, nel;corpo a corpo;, hanno iniziato a giocare il loro rugby di qualità superiore.;sg;idiosyncratic;nominal
corpo a corpo;idiosyncratic;a;corpo;Joey che lottava contro il divano, mentre due uomini ingaggiavano un;corpo a corpo;con lui.;sg;idiosyncratic;nominal
corpo a corpo;idiosyncratic;a;corpo;Talvolta la vecchia ostilità di Retancourt nei confronti di Adamsberg tornava a riaffiorare alla superficie dei loro rapporti, benché il loro contenzioso si fosse risolto in Qué bec, in uno straordinario;corpo a corpo;che aveva realizzato una fusione per tutta la vita tra il tenente e il suo commissario.;sg;idiosyncratic;nominal
corpo a corpo;idiosyncratic;a;corpo;A volte, e dopo il;corpo a corpo;che aveva salvato le loro due vite, il commissario e il tenente cambiavano registro come un treno cambia binario, passando al tu della complicità intima e definitiva.;sg;idiosyncratic;nominal
corpo a corpo;idiosyncratic;a;corpo;Nel;corpo a corpo;"per lavarci i capelli, mamma canticchiava: ""Nell'Italia, e dei Rossetti, no se parla no se parla che italian"".";sg;idiosyncratic;nominal
corpo a corpo;idiosyncratic;a;corpo;Gli scontri, compresi violenti;corpo a corpo;, avvengono all'interno di villa Doria Pamphili e lungo l'Aurelia.;sg;idiosyncratic;nominal
corpo a corpo;idiosyncratic;a;corpo;Era Marlon Brando, mica Pippo Inzaghi, che si avventava su Vivien Leigh: «Vuoi un;corpo a corpo;? È questo che vuoi? Ti accontento».;sg;idiosyncratic;nominal
corpo a corpo;idiosyncratic;a;corpo;"Tutt'intorno, uno scenario da incubo: due donne ferite che gemevano in un lago di sangue, i clienti del supermercato ""Panorama"", sulla Tiburtina, che scappavano terrorizzati, un vigilante con la divisa insanguinata, pallido come un morto dopo un furioso";corpo a corpo;con l'uomo del coltello.;sg;idiosyncratic;nominal
corpo a corpo;idiosyncratic;a;corpo;La maglia rosa passa sulle spalle di Alexandre Vinokourov: oggi la gara è stata un tremendo;corpo a corpo;, l'ideale per un duro come il kazako.;sg;idiosyncratic;nominal
corpo a corpo;idiosyncratic;a;corpo;Ma questo ha coinciso anche con una lotta, una lotta quotidiana, un;corpo a corpo;silenzioso, come un combattimento ombra.;sg;idiosyncratic;nominal
corpo a corpo;idiosyncratic;a;corpo;A braccia larghe venne addosso per il;corpo a corpo;, feci la mossa di sollevarmi in tutta la statura, lui alzò la testa per guardarmi in faccia ed ebbe in pieno il rimbalzo di luce che cercavo.;sg;idiosyncratic;nominal
corpo a corpo;idiosyncratic;a;corpo;Ma i capelli corti erano per impedire che qualcuno avesse modo di afferrarla durante un;corpo a corpo;, l'espressione severa rappresentava una distanza da mantenere, incrociare le braccia poteva significare insicurezza, toccare una persona serviva a trasmettere un senso di protezione e instaurare un rapporto di confidenza necessario per farla aprire e confidare.;sg;idiosyncratic;nominal
corpo a corpo;idiosyncratic;a;corpo;Aveva continuato a corteggiarle per abitudine, sfinendole in estenuanti;corpo a corpo;telefonici.;sg;idiosyncratic;nominal
corpo a corpo;idiosyncratic;a;corpo;Allora in quel caso tutti gli schemi saltano, tutto quello che c'è stato primadel;corpo a corpo;con la regina degli sport sono stati come innocui bacetti formali dati ai cugini o ai nonni.;sg;idiosyncratic;nominal
corpo a corpo;idiosyncratic;a;corpo;Avrei voluto vedere te, impegnato in un;corpo a corpo;con 210 Bloddeuwedd.;sg;idiosyncratic;nominal
corpo a corpo;idiosyncratic;a;corpo;Ma, dicono le cronache, amava il marito, il loro era un interminabile testa a testa, un;corpo a corpo;infinito, struggente.;sg;idiosyncratic;nominal
corpo a corpo;idiosyncratic;a;corpo;Al;corpo a corpo;c'è mancato un pelo.;sg;idiosyncratic;nominal
corpo a corpo;idiosyncratic;a;corpo;Perché il Biarritz ha giocato con la squadra vera, acominciareda capitan Harinordoquy, perché in Heineken nessuno scherza e perché gli 80 minuti sono stati un durissimo;corpo a corpo;risolto solo a 2 minuti dalla fine da un drop di Laharrague (ex Biarritz).;sg;idiosyncratic;nominal
corpo a corpo;idiosyncratic;a;corpo;La veglia notturna, per lungo tratto, è diventata un esercizio riservato alla liturgia monastica, con quelle alzatacce nel cuore della notte, alla luce fioca delle candele, quel prendersi cura del tempo dell'oblio attraverso un;corpo a corpo;tenero e spigoloso con Dio.;sg;idiosyncratic;nominal
corpo a corpo;idiosyncratic;a;corpo;La solitudine di un uomo che, applicando le leggi, incrocia il;corpo a corpo;.;sg;idiosyncratic;nominal
corpo a corpo;idiosyncratic;a;corpo;E aggiungo: l'impegno deve essere un;corpo a corpo;.;sg;idiosyncratic;nominal
corpo a corpo;idiosyncratic;a;corpo;"A mezzanotte e un quarto avanzò anche Cutty con due compagnie, dopo aver constatato che il terreno difrontea sé non era minato: da quella parte gli egiziani non si aspettavano un attacco, e i loro obici continuarono a sparare lontano finoa quando gli artiglieri non si ritrovarono i soldati nemici addosso; dopo un";corpo a corpo;di due ore, le prime due trincee erano nelle mani degli israeliani, e un'ora dopo la terza veniva attaccata dalla compagnia di riserva di Cutty.;sg;idiosyncratic;nominal
corpo a corpo;idiosyncratic;a;corpo;Capirei con un pugnale o un'ascia in un;corpo a corpo;come tra due gladiatori di specie diverse e ugualmente potenti, ma da un casotto in cui si nasconde il vile cacciatore munito di veri e propri cannoni che oltretutto si confronta con delle anatre o delle allodole!;sg;idiosyncratic;nominal
corpo a corpo;idiosyncratic;a;corpo;Nei giorni seguenti la Comune si era spenta, con un ultimo;corpo a corpo;all'arma bianca nel cimitero del Père - Lachaise.;sg;idiosyncratic;nominal
corpo a corpo;idiosyncratic;a;corpo;Armi da fuoco e da taglio,;corpo a corpo;, esplosivi.;sg;idiosyncratic;nominal
corpo a corpo;idiosyncratic;a;corpo;A giudicare dallo sguardo, anche l'istruttore amante del;corpo a corpo;e delle armi da taglio se n'era reso conto.;sg;idiosyncratic;nominal
corpo a corpo;idiosyncratic;a;corpo;Vuoi un;corpo a corpo;, eh? Va bene, ti accontento.;sg;idiosyncratic;nominal
corpo a corpo;idiosyncratic;a;corpo;Allora Rambo spegne di nuovo la luce, prende il sacchetto e gli va incontro, petto contro petto lo spinge fuori e questo;corpo a corpo;non gli fa nessun effetto, nessun fremito sotto la pelle, solo lo scontro primitivo fra esseri umani.;sg;idiosyncratic;nominal
corpo a corpo;idiosyncratic;a;corpo;Flavus notò che il ragazzo chiamato Germanico era adesso duramente impegnato in un;corpo a corpo;.;sg;idiosyncratic;nominal
corpo a corpo;idiosyncratic;a;corpo;Sergio Vetilio riprese il suo racconto: «Crasso schierò i suoi in un blocco compatto che divenne così ancora più facile da accerchiare per i nemici che non ingaggiavano mai il;corpo a corpo;ma sempre colpivano da lontano e poi si disimpegnavano.;sg;idiosyncratic;nominal
corpo a corpo;idiosyncratic;a;corpo;Gli attivisti sono arrivati quasi al;corpo a corpo;"con il deputato gridandogli ""venduto"" e accusandolo per la sua scelta di lasciare il Movimento, insiemead altri nove parlamentari, alla vigilia del voto per il Colle.";sg;idiosyncratic;nominal
corpo a corpo;idiosyncratic;a;corpo;Eravamo tutt'e due quello che i pugili chiamano dei «ghiottoni» (un termine dello slang sportivo che designava chi non ha paura del;corpo a corpo;, e si lascia massacrare piuttosto che arrendersi).;sg;idiosyncratic;nominal
corpo a corpo;idiosyncratic;a;corpo;Drndic ingaggia una sfida con l'oblio, un doloroso;corpo a corpo;: ciò che torna, torna per lampi, presagi a rovescio, indizi materiali, fonti fragilissime di un'archeologia dell'altroieri.;sg;idiosyncratic;nominal
corpo a corpo;idiosyncratic;a;corpo;E ancora: a Poitiers Carlo Martello riesce a fermare l'espansione degli arabi in Europa perché impone ai suoi fanti di attendere i cavalieri berberi a piè fermo per il;corpo a corpo;, evitando così la trappola della tattica evasiva musulmana dell'«al - qarr wa al - farr», cioè dell'attacco seguito da una programmata ritirata, mirante a illudere l'avversario, per poi portare un improvviso e inatteso nuovo attacco.;sg;idiosyncratic;nominal
corpo a corpo;idiosyncratic;a;corpo;Queste si frequentano, ma non permettono di costruire un;corpo a corpo;con i libri.;sg;idiosyncratic;nominal
corpo a corpo;idiosyncratic;a;corpo;Cerchiamo libri in cui il sentimento deflagra, in cui la verità non è solo nello stile o nella forma, ma nella stessa pregnanza della parola, dove gli scrittori mettono in gioco se stessi, si mostrano al lettore in modo arrendevole, in un atto ultimativo, eppure proprio in questa loro arrendevolezza è già insita l'aggressione, il;corpo a corpo;che intraprendono con ciò che intendono raccontare.;sg;idiosyncratic;nominal
corpo a corpo;idiosyncratic;a;corpo;Si è barricato nel suo tugurio, impegnato in un interminabile;corpo a corpo;con la suscettibile divinità cibernetica.;sg;idiosyncratic;nominal
corpo a corpo;idiosyncratic;a;corpo;Cominciò il;corpo a corpo;tra la folla e la milizia e più nessuno ebbe pietà: il leone affamato non strappa così a brano a brano l'antilope che ha ucciso e che sta mangiando.;sg;idiosyncratic;nominal
corpo a corpo;idiosyncratic;a;corpo;Arrivarono altri battaglioni della milizia che circondarono la spianata e aprirono il fuoco concentrico volendo una carneficina feroce che non risparmiò neppure i miliziani sopravvissuti al;corpo a corpo;con la folla, ma ancora nella spianata.;sg;idiosyncratic;nominal
corpo a corpo;idiosyncratic;a;corpo;Interminabili marce nel sole, esercitazioni al poligono, addestramenti nel;corpo a corpo;, scoppi simulati per abituarsi a calcolare la distanza di un colpo: sfacchinate da lasciarti secco.;sg;idiosyncratic;nominal
corpo a corpo;idiosyncratic;a;corpo;Nell'insieme, grazieal mio tempestivo intervento, fu un combattimento a distanza, tranne qualche punto in cui ci furono dei;corpo a corpo;, alla luce dei falò e del sole che ormai si stava alzando.;sg;idiosyncratic;nominal
corpo a corpo;idiosyncratic;a;corpo;E son salve di cannone, colpi di moschetto, mentre i temi si affrontano in un;corpo a corpo;"da rimanerci schiantati; e meno male che ero già sordo.";sg;idiosyncratic;nominal
corpo a corpo;idiosyncratic;a;corpo;Non mi stupii visto che stava affrontando il piano in un;corpo a corpo;.;sg;idiosyncratic;nominal
corpo a corpo;idiosyncratic;a;corpo;Non mi spostò la mano, fui io a ritirarla per far perdurare l'attesa di un;corpo a corpo;senza vinti, per due vincitori.;sg;idiosyncratic;nominal
corpo a corpo;idiosyncratic;a;corpo;E poi, obiettivamente, la sua utilità in un;corpo a corpo;era tutta da dimostrare.;sg;idiosyncratic;nominal
corpo a corpo;idiosyncratic;a;corpo;Nei precedenti;corpo a corpo;avevo avuto fortuna, ma in quel momento ero disarmato di gondole e nessun vigile passava di lì a distrarlo.;sg;idiosyncratic;nominal
corpo a corpo;idiosyncratic;a;corpo;Fu quella notte che le spaccai il cranio con la mazza in un;corpo a corpo;rischioso.;sg;idiosyncratic;nominal
corpo a corpo;idiosyncratic;a;corpo;Feroce fu la lotta nel;corpo a corpo;.;sg;idiosyncratic;nominal
corpo a corpo;idiosyncratic;a;corpo;Poreda sembra muoversi meglio nel;corpo a corpo; (sta' zitto bastardo , sta' zitto) l'arbitro divide i due pugili.;sg;idiosyncratic;nominal
corpo a corpo;idiosyncratic;a;corpo;L'arcivescovo era abbastanza grande e grosso, di corpo e di dottrina, da presidiare con successo la motoretta anche contro l'intero sinodo frisone, senza contare che aspettava da tempo un;corpo a corpo;con il cardinale di Trastevere che troppo rozzamente usava le mani al posto di Sua Santità.;sg;idiosyncratic;nominal
corpo a corpo;idiosyncratic;a;corpo;Parmenione, che pure lo aveva osservato combattere tre anni prima a Cheronea, rimase attonito e sgomento al vederlo immergersi nel;corpo a corpo;, dimentico di tutto, come in preda a un furore incontrollabile, animato da un vigore inesauribile, urlando, mietendo i nemici con la spada e con l'ascia, spingendo Bucefalo, corazzato di bronzo, contro le file avversarie fino ad aprire un varco in cui trascinarsi dietro la cavalleria pesante e la fanteria d'assalto.;sg;idiosyncratic;nominal
corpo a corpo;idiosyncratic;a;corpo;In un primo momento, i tebani dovettero arretrare non potendo sopportare l'impatto formidabile della falange, ma quando vennero al;corpo a corpo;su un terreno più accidentato dimostrarono la loro superiorità cosicché, per ore e ore, le sorti del combattimento sembrarono sospese, quasi gli dei le avessero messe sui piatti di una bilancia in perfetto equilibrio.;sg;idiosyncratic;nominal
corpo a corpo;idiosyncratic;a;corpo;In battaglia erano feroci come belve, e nel;corpo a corpo;si eccitavano al punto da strappare a morsi le carni degli avversari.;sg;idiosyncratic;nominal
corpo a corpo;idiosyncratic;a;corpo;Erano guerrieri traci e triballi, feroci come belve, e correvano sui lati scagliando nugoli di frecce e giavellotti, aspettando di potersi gettare nel;corpo a corpo;appena avessero visto il nemico esausto e dissanguato.;sg;idiosyncratic;nominal
corpo a corpo;idiosyncratic;a;corpo;Poi la cavalleria persiana volse in fuga, inseguita dagli eteri, dai tessali e dalla velocissima cavalleria leggera dei traci e dei triballi, ormai scatenati in furibondi;corpo a corpo;.;sg;idiosyncratic;nominal
corpo a corpo;idiosyncratic;a;corpo;Dovettero impugnare i giavellotti per tenerli a bada, ma nel buio non riuscivano a prendere la mira e men che meno a usare archi e frecce, sicché spesso si trovavano improvvisamente aggrediti e dovevano ingaggiare un;corpo a corpo;usando il pugnale.;sg;idiosyncratic;nominal
corpo a corpo;idiosyncratic;a;corpo;Il terreno accidentato e scivoloso, la presenza di rocce sul greto e sulla sponda disgregarono lo schieramento macedone e i greci si gettarono nelle fratture impegnando gli eteri in furibondi;corpo a corpo;.;sg;idiosyncratic;nominal
corpo a corpo;idiosyncratic;a;corpo;Quando il sole cominciava ormai a declinare verso il mare, i traci e gli agriani ebbero finalmente ragione della cavalleria persiana che avevano fronteggiato, si radunarono e andarono a dare man forte ai reparti di fanteria impegnati nell'aspro;corpo a corpo;.;sg;idiosyncratic;nominal
corpo a corpo;idiosyncratic;a;corpo;Parte degli agriani intanto, esaurite le frecce, avevano messo mano ai coltellacci e si erano gettati nella mischia trascinati dal loro furore barbarico, ingaggiando selvaggi;corpo a corpo;con i cavalieri nemici che passavano come spettri nella densa foschia.;sg;idiosyncratic;nominal
corpo a corpo;idiosyncratic;a;corpo;La cavalleria di Alessandro scavalcò d'impeto il terrapieno che proteggeva alle spalle il presidio, e la fanteria seguì subito dopo impegnando i difensori in un duro;corpo a corpo;.;sg;idiosyncratic;nominal
corpo a corpo;idiosyncratic;a;corpo;Colti di sorpresa e presi completamente nel mezzo, gli sciti dovettero impegnare il;corpo a corpo;ammassati in uno spazio troppo breve e senza la possibilità di sfuggire sui lati.;sg;idiosyncratic;nominal
corpo a corpo;idiosyncratic;a;corpo;Superata la linea dei carri, Alessandro lanciò all'assalto la cavalleria sulle ali, impegnando un furioso;corpo a corpo;contro la cavalleria indiana che si batteva con grande valore.;sg;idiosyncratic;nominal
corpo a corpo;idiosyncratic;a;corpo;Philip sentì un crampo allo stomaco vedendo la testa rotolare fra i piedi del suo cavallo ma si fece forza e spronò nuovamente verso la carovana asserragliata dove un gruppo di beduini erano riusciti a piombare sui difensori impegnandoli in un;corpo a corpo;.;sg;idiosyncratic;nominal
corpo a corpo;idiosyncratic;a;corpo;Anche gli uomini con le mitragliatrici si volsero ma non potevano sparare per non colpire i compagni che già erano impegnati nel;corpo a corpo;.;sg;idiosyncratic;nominal
corpo a corpo;idiosyncratic;a;corpo;Altri due squadroni si lanciarono contro i Blemmi sparando con i fucili a ripetizione, martellando di colpi la superficie del deserto e altri ancora si gettavano dai cavalli ingaggiando un selvaggio;corpo a corpo;.;sg;idiosyncratic;nominal
corpo a corpo;idiosyncratic;a;corpo;Se bisticciavamo, lo facevamo con la stessa aggressività, menando botte secche, senza risse o confusi;corpo a corpo;.;sg;idiosyncratic;nominal
corpo a corpo;idiosyncratic;a;corpo;Questo;corpo a corpo;permanente genera in me una tenerezza tinta di sensualità.;sg;idiosyncratic;nominal
corpo a corpo;idiosyncratic;a;corpo;Io approfitto di questi;corpo a corpo;così calorosi, di questi sguardi di complicità con lei.;sg;idiosyncratic;nominal
