faccia a faccia;;a;faccia;zo - COLLOQUI DI PACE Incontro_a Ginevra con il leader palestinese . Poi nuovo  faccia a faccia notturno con Netaniahu Palestina , tornano i piccoli passi La Albright annuncia;;;;;
faccia a faccia;;a;faccia;"prossimi quattro anni . Più sicuro e rilassato di quando doveva sostenere i ""  faccia a faccia "" con l ' antagonista al ballottaggio , Salvatore Forte , il sindaco del centro";;;;;
faccia a faccia;;a;faccia;i sia tutto sommato poco allarmante per l ' Occidente . Da Torino , durante il  faccia a faccia con Sergio Cofferati organizzato per il ventennale di Finpiemonte , Agnelli sos;;;;;
faccia a faccia;;a;faccia;"a . Il candidato sindaco taglia corto : "" Panzane . Non mi sono sottratto ai ""  faccia a faccia "" con i miei avversari . Ad ogni buon conto , non cambio parere sull ' inutilit";;;;;
faccia a faccia;;a;faccia;"nale e sui nervi scossi della Roma : "" So molto bene cosa significa perdere il  faccia a faccia con la Lazio . Si soffre , si sta malissimo e per molto tempo . E si perdono ce";;;;;
faccia a faccia;;a;faccia;"può ben digerire il sindaco uscente di Roma Francesco Rutelli , che nega il ""  faccia a faccia "" al candidato del Polo Pierluigi Borghini , uomo magro e irritabile , se non s";;;;;
faccia a faccia;;a;faccia;", se non si ascolta , sia pure privatamente , che cosa Borghini intenda per ""  faccia a faccia "" : "" Ci togliamo i calzoni e andiamo in giro per la città , così i romani poss";;;;;
faccia a faccia;;a;faccia;"cchie , superficiali tecniche di propaganda vanno superate "" . Dai Faccioni ai  faccia a faccia : la campagna elettorale non è fortunatamente fatta solo di manifesti . Il tema";;;;;
faccia a faccia;;a;faccia;""" Lo ha stabilito la Commissione parlamentare di vigilanza e ora mi attendo un  faccia a faccia con Rutelli . Ho diritto di porre al sindaco in carica domande ben precise "" .";;;;;
faccia a faccia;;a;faccia;"arci con tutto il mondo "" . Per due giorni Tokio si è trovata ad anticipare il  faccia a faccia tra governo e imprenditori . Il presidente del Consiglio ride davanti_all ' ide";;;;;
faccia a faccia;;a;faccia;osta di Antonio Bassolino all ' invito Rai . O tutti o nessuno : quindi niente  faccia a faccia con Pierluigi Borghini del Polo per Rutelli , nè con Novi per Bassolino . La no;;;;;
faccia a faccia;;a;faccia;poste per salvare la faccia : Balduccio Di Maggio e Gioacchino La Barbera , un  faccia a faccia infinito dopo_che li hanno beccati a comunicare tra di loro proprio nel momento;;;;;
faccia a faccia;;a;faccia;Balduccio a San Giuseppe Jato . Scatta così il confronto : Lo Forte dispone il  faccia a faccia tra Di Maggio , accompagnato dal suo legale torinese Michele Polleri , e La Bar;;;;;
faccia a faccia;;a;faccia;ndo ci sono di mezzo io , che non ho mai nascosto le mie simpatie sportive , i  faccia a faccia con la Lazio prendono inevitabilmente un altro sapore . Il che mi esalta , come;;;;;
faccia a faccia;;a;faccia;tatti anche tra il leader del Prc e Massimo D ' Alema , in attesa del previsto  faccia a faccia . Anche_se Palazzo Chigi , con Enrico Micheli , sostiene che la Finanziaria può;;;;;
faccia a faccia;;a;faccia;ti nello studio di Walter Veltroni a Palazzo Chigi mentre , appena tornato dal  faccia a faccia con il presidente della Repubblica , Prodi riceve il leader della Quercia . Res;;;;;
faccia a faccia;;a;faccia;liata della sconfitta rimediata in casa domenica scorsa contro il Vicenza . Un  faccia a faccia con i giocatori , presente anche lo psicologo Bruno Demichelis . Al nucleo stor;;;;;
faccia a faccia;;a;faccia;"o invitato a spiegare dove fosse giovedì , il giorno in cui lo si attendeva al  faccia a faccia in sala stampa con Schumacher . "" Giovedì ero a Silverstone "" . A fare che cosa";;;;;
faccia a faccia;;a;faccia;, diretto all ' aeroporto , sono passate da poco le otto e mezzo di sera . Il  faccia a faccia con Colombo e la Boccassini si è concluso da più di due ore . E lì fuori_dall ';;;;;
faccia a faccia;;a;faccia;"ervenga sulle procure "" ROMA - Tregua a sinistra sullo Stato sociale . Dopo un  faccia a faccia con Fausto Bertinotti , Massimo D ' Alema ha lanciato segnali distensivi a Rifo";;;;;
faccia a faccia;;a;faccia;i e Berlusconi non sarà sullo stato sociale . Ma tutti sanno che al centro del  faccia a faccia ci sarà proprio la riforma del welfare . Perché è intorno_a questa che ruotano;;;;;
faccia a faccia;;a;faccia;dallo sguardo , dagli occhi dei veri cronisti , pensa che i giornalisti , e i  faccia a faccia , e le domande realmente imbarazzanti immancabilmente lo snaturino , lo travisi;;;;;
faccia a faccia;;a;faccia;"dell ' Interno che era giunto al "" Leonardo da Vinci "" con largo anticipo . Il  faccia a faccia tra Prodi e Napolitano è durato circa un ' ora e solo all ' ultimo minuto è sta";;;;;
faccia a faccia;;a;faccia;"orerò su questa linea . Non c ' è spazio per discussioni "" . Moeller , dopo il  faccia a faccia con Scala , ha fatto autocritica . "" Forse mi sono lasciato andare . È stato un";;;;;
faccia a faccia;;a;faccia;"un caffè , italiano "" . Ma nei prossimi giorni dovrebbe avere anche lui il suo  faccia a faccia con Tonino . 30 07 1997 Sacchi Maria Silvia - PUNTO PER PUNTO Prodi : aree di c";;;;;
faccia a faccia;;a;faccia;"micizia "" . Ma più che sui campi sportivi il prossimo appuntamento per un vero  faccia a faccia potrebbe essere all ' Università la "" Sapienza "" . Il rettore Giorgio Tecce , p";;;;;
faccia a faccia;;a;faccia;"sta , Armando Cossutta , rispondendo a una domanda di Bruno Vespa durante un ""  faccia a faccia "" con Walter Veltroni alla Festa di Liberazione . Cossutta ha spiegato che Rifo";;;;;
faccia a faccia;;a;faccia;"ne "" Venti alle venti "" ( Rai 3 ) aveva invitato entrambi per dare spazio a un  faccia a faccia chiarificatore . Ma il Cavaliere ha detto no : "" Mi dispiace , ma la risposta è";;;;;
faccia a faccia;;a;faccia;one , per uno share del 16,26 % . Nel gennaio ' 96 , quando si svolse il primo  faccia a faccia tra i due ( in quel periodo Antonio Maccanico tentò , senza successo , di evita;;;;;
faccia a faccia;;a;faccia;"o . Pace fatta ? In un angolo Gad Lerner , il conduttore che ha organizzato il  faccia a faccia , sorride soddisfatto : "" Non hanno appianato le differenze , ma almeno c ' è s";;;;;
faccia a faccia;;a;faccia;prossimi giorni si presenterà spontaneamente davanti_al magistrato . Un primo  faccia a faccia c ' era già stato agli inizi di febbraio . In quell ' occasione la cantante ave;;;;;
faccia a faccia;;a;faccia;"inquilino di Downing Street , il leader laburista Tony Blair , si sono trovati  faccia a faccia , presenti anche il ministro degli Esteri Lamberto Dini e lo stesso Cook . "" Bl";;;;;
faccia a faccia;;a;faccia;a e internazionale . Ma è trapelato anche che Prodi e Fazio avrebbero avuto un  faccia a faccia . Temi pressoché obbligati : la riforma del welfare , la preparazione del Docum;;;;;
faccia a faccia;;a;faccia;ndo dal suo appartamento del secondo piano quando , sulla porta , si è trovata  faccia a faccia con uno sconosciuto armato di coltello . Il malvivente , minacciando di sgozzar;;;;;
faccia a faccia;;a;faccia;tirsi garantito dalle misure di sicurezza offerte . Non ha tuttavia escluso il  faccia a faccia , alla presenza del mediatore dell ' Onu , Mohammed Shanoun , che era stato pre;;;;;
faccia a faccia;;a;faccia;"continuare la lotta cominciata dal padre , rilanciano la sfida : "" Vogliamo un  faccia a faccia pubblico con i vertici dell ' Atm , a costo di chiudere baracca e burattini e d";;;;;
faccia a faccia;;a;faccia;i siede e lo fanno ragionare , va molto bene . Ricordo quando preparammo i due  faccia a faccia prima_delle elezioni . Ci chiudemmo in una stanza per tre giorni , a studiare g;;;;;
faccia a faccia;;a;faccia;raccogliere le voci di questa riemersione , della lotta contro l ' oblio , del  faccia a faccia con lo spettro della morte a lungo serbato negli anfratti del ricordo . Da alcu;;;;;
faccia a faccia;;a;faccia;diventata eccessiva : sul posto di lavoro e fuori_dai cancelli , al telefono e  faccia a faccia . Così la giovane donna si è rivolta all ' azienda e ha denunciato il dirigente;;;;;
faccia a faccia;;a;faccia;ettimane dalle elezioni la sfida a tre resta aperta . I candidati accettano il  faccia a faccia pubblico Ultimo sondaggio , il Polo non vola Albertini in vantaggio , ma Formen;;;;;
faccia a faccia;;a;faccia;- - - - - Il presidente Sensi forse già oggi , scenderà a Trigoria per un duro  faccia a faccia con la squadra dopo l ' umiliazione di sabato patita contro la Juventus . Carlo;;;;;
faccia a faccia;;a;faccia;' Italia non è neutrale rispetto_al Consiglio di stabilità così come esce dal  faccia a faccia Arthuis - Waigel . Già prima_del vertice europeo di Dublino in dicembre Ciampi;;;;;
Faccia a faccia;;a;faccia;ic e la sua polizia , comincia la mattina del 21 gennaio nella via Kolarceva .  Faccia a faccia con gli agenti , nel segno inconsapevole di quel doppio slogan che trent ' anni;;;;;
faccia a faccia;;a;faccia;"... "" . 07 03 1997 Caprara Maurizio - Prima_del vertice con i sei ministri un  faccia a faccia tra premier e presidente della Repubblica . Treu : raccolto l ' invito a veloci";;;;;
faccia a faccia;;a;faccia;"zione "" . Il segretario di Rifondazione dopo aver incontrato Prodi ha avuto un  faccia a faccia anche con il vicepresidente del Consiglio Walter Veltroni . Ai giornalisti che";;;;;
faccia a faccia;;a;faccia;le : parte un ' ovazione dalla platea dei delegati Pds ROMA - Un ' ora e mezzo  faccia a faccia a palazzo Chigi : Prodi e Berlusconi discutono della proposta del Cavaliere di;;;;;
faccia a faccia;;a;faccia;è accaduto ieri , con l ' incontro tra Prodi e Berlusconi . Intendiamoci . Il  faccia a faccia tra il capo del governo e il leader del Polo tutto è fuorché un colpo di teatro;;;;;
faccia a faccia;;a;faccia;"comunità ebraiche e le associazioni di amicizia Italia - Israele . Alle 19 il  faccia a faccia di lavoro con Prodi seguito dalla cena ufficiale , dove , "" non ci saranno lead";;;;;
faccia a faccia;;a;faccia;OSTRO INVIATO GERUSALEMME - Benjamin Netaniahu e Yasser Arafat si sono trovati  faccia a faccia nel mezzo della notte per cercare di concludere l ' accordo per il ritiro israe;;;;;
faccia a faccia;;a;faccia;"rca 400 coloni ebrei ) si trascinano di crisi in crisi . Questo sarà il quinto  faccia a faccia tra i due leader . E la "" questione Hebron "" ha assunto via via un ruolo centra";;;;;
faccia a faccia;;a;faccia;, in realtà non si sono mai completamente interrotte dopo il primo incontro_a  faccia a faccia fra Cerpa e Palermo il 28 dicembre . Le due parti si parlano attraverso la radi;;;;;
faccia a faccia;;a;faccia;primi incontri con il ministero del Tesoro e la Banca d ' Italia , mentre il <  faccia a faccia > con Visco avrà luogo lunedì prossimo . Alla fine della visita , verrà redatto;;;;;
faccia a faccia;;a;faccia;o italiano ha ribadito la necessità di difendere i redditi delle imprese . Nel  faccia a faccia svoltosi a Palazzo Chigi tra Fischler e Prodi martedì scorso , il capo dell ' E;;;;;
faccia a faccia;;a;faccia;uovi stabilimenti con 400 occupati - ripropone la sua ricetta per il Sud in un  faccia a faccia con Agostino Megale , segretario generale della Filtea - Cgil . < Se al Sud non;;;;;
faccia a faccia;;a;faccia;randi forze irresponsabili . D ' Alema non ha voluto perdere l ' occasione del  faccia a faccia con un autorevole rappresentante dell ' imprenditoria italiana per porre sul ta;;;;;
faccia a faccia;;a;faccia;prossimi anche nella commercializzazione delle aree retroportuali ) a Psa . Un  faccia a faccia tra il gigante di Hong Kong , Hutchinson Wampoa , e la stessa Sinport ( Fiatimp;;;;;
faccia a faccia;;a;faccia;itel in circa 10mila miliardi . Intanto mercoledì ci sarà a Bruxelles il primo  faccia a faccia tra il commissario alla concorrenza Ue , Karel Van Miert , e i nuovi vertici de;;;;;
faccia a faccia;;a;faccia;belli Laurent Desirè Kabila , anche_se non è chiaro se l ' interpretazione del  faccia a faccia fornita da Kabila sia veramente condivisa dal capo di Stato zairese . < Ho dato;;;;;
faccia a faccia;;a;faccia;visto il buon successo dell ' incontro sulla professione dell ' avvocato e il  faccia a faccia in videoconferenza con il presidente della Borsa di New York . Alla ribalta di;;;;;
faccia a faccia;;a;faccia;lo con tutte le altre forze che sostengono il Governo e non in un più semplice  faccia a faccia con il presidente del Consiglio . Ed è significativo che la riunione si sia con;;;;;
faccia a faccia;;a;faccia;sso di pace che ha messo fine a secoli di ostilità - ha detto al termine di un  faccia a faccia con Khatami - creando una possibilità che non deve andare perduta a_causa_di er;;;;;
faccia a faccia;;a;faccia;"tori che scelgono e decidono senza badare alle capacità "" . Comincia così il ""  faccia a faccia "" tra i due grandi registi del brivido . Ed è un inizio che segna la fine da ap";;;;;
faccia a faccia;;a;faccia;questione affrontata nell ' ufficio del sindaco , dai capigruppo che , dopo il  faccia a faccia fra Castellani ( affiancato dall ' assessore ai Servizi sociali Lepri ) con la;;;;;
faccia a faccia;;a;faccia;"une ce l ' hanno : il carattere "" forte "" , come hanno dimostrato nei numerosi  faccia a faccia in cui tutti e due volevano avere l ' ultima parola . Entrambi del resto sono a";;;;;
faccia a faccia;;a;faccia;"icata alla contessa Clara Agnelli Nuvoletti , sorella dell ' Avvocato . Poi un  faccia a faccia con Sergio Cusani , intervistato a San Vittore ; con la madre di Silvio Berlusc";;;;;
faccia a faccia;;a;faccia;1 miliardo e 400 milioni , il prezzo della libertà della mamma di Tortolì . Il  faccia a faccia si è concluso solo a tarda notte , alle 21.45 . L ' imprenditore è riemerso dal;;;;;
faccia a faccia;;a;faccia;"no perché è fuori_dal suo costume di vita muovere accuse verso chiunque "" . Il  faccia a faccia tra Pacini Battaglia e D ' Adamo , cui ha assistito anche il procuratore Andrea";;;;;
faccia a faccia;;a;faccia;"probatorio "" . Trocchia e Sommese sono stati messi a confronto , un drammatico  faccia a faccia tra i due cognati andato in scena nel dialetto stretto dell ' entroterra napole";;;;;
faccia a faccia;;a;faccia;chino vie d ' uscita non traumatiche per i carabinieri e per i magistrati . Un  faccia a faccia c ' è stato con il ministro della Giustizia Flick , che già oggi potrebbe ricev;;;;;
faccia a faccia;;a;faccia;ardo Versato da Rovelli a Pacifico . Ma il finanziere nega MILANO . L ' ultimo  faccia a faccia si è svolto sabato , nel carcere di Opera . Lei , carte svizzere alla mano , gl;;;;;
faccia a faccia;;a;faccia;sono stati ascoltati per 12 ore : poi Di Maggio e La Barbera sono stati messi  faccia a faccia . I carabinieri , inoltre , hanno arrestato a San Giuseppe Jato il presunto kil;;;;;
faccia a faccia;;a;faccia;verso la fine della settimana scorsa , per essere più precisi alla vigilia del  faccia a faccia D ' Alema - Fini al convegno dei giovani industriali a Capri , un messaggero di;;;;;
faccia a faccia;;a;faccia;nte si stimano a vicenda , prima_della grande sfida . D ' ora in poi , dopo il  faccia a faccia di ieri , i loro sguardi non si incroceranno più , al massimo in pista in una e;;;;;
faccia a faccia;;a;faccia;sabato pomeriggio Massimo D ' Alema avrebbe incontrato Scalfaro . Ma di questo  faccia a faccia non c ' è nessuna conferma . Mentre si sa che in questa domenica ingarbugliata;;;;;
faccia a faccia;;a;faccia;ione definitiva alla direzione del suo partito che precederà di qualche ora il  faccia a faccia con Prodi . Anche_se il presidente del Consiglio ha ribadito di essere contrari;;;;;
faccia a faccia;;a;faccia;Solana , segretario generale della Nato , è stato protagonista di un inatteso  faccia a faccia con Ramon Mantovani , responsabile Esteri di Rifondazione , durante una tavola;;;;;
faccia a faccia;;a;faccia;o . Al pessimismo del premier risponde il tentativo di D ' Alema , che dopo un  faccia a faccia con il premier vuole incontrare Bertinotti . Cauto il Polo . La richiesta di Ri;;;;;
faccia a faccia;;a;faccia;cupazioni , Romano Prodi a palazzo Chigi . Nessuna dichiarazione dopo il breve  faccia a faccia , ma il tema della conversazione è facilmente intuibile . La lira e i titoli di;;;;;
faccia a faccia;;a;faccia;o scenario preferito , ma alcune sue mezze parole fanno venire il dubbio . Nel  faccia a faccia con il segretario della Cgil Cofferati al Maurizio Costanzo Show , Bertinotti p;;;;;
faccia a faccia;;a;faccia;o fissato il vertice tecnico con Micheli e Treu . Così come non c ' è stato un  faccia a faccia specifico con Bertinotti : Ci siamo sentiti al telefono , dovrò incontrarlo la;;;;;
faccia a faccia;;a;faccia;ioni pubbliche molto dure , poi si tratta di mettersi a tavolino , a discutere  faccia a faccia . E lì il discorso può cambiare . Almeno , questo auspica Romano . Solo un ausp;;;;;
faccia a faccia;;a;faccia;uscì malamente dalla Coppa e poi vinse il titolo ... Oggi , a Orbassano , nel  faccia a faccia con la squadra , Souness chiederà spiegazioni ai suoi : è furioso per gli error;;;;;
faccia a faccia;;a;faccia;no rapidamente sulla tavola , d ' incavo in incavo . I due concorrenti siedono  faccia a faccia su sgabelli sinuosamente scolpiti : a me viene dato quello con il simbolo del G;;;;;
faccia a faccia;;a;faccia;rte dell ' agenzia risultavano pagati rimborsi per incidenti mai avvenuti . Il  faccia a faccia è durato circa tre ore , ma nessuno si è spostato di una virgola dalle posizion;;;;;
faccia a faccia;;a;faccia;aveva definiti così , subito dopo i primi interrogatori , le prime ore passate  faccia a faccia con quei ragazzi accusati di omicidio volontario . E oggi , il giorno dopo le r;;;;;
faccia a faccia;;a;faccia;quella della festa nazionale di Liberazione che si tiene a Roma . L ' insolito  faccia a faccia è stato preparato con cura grazie_a Francesco Demitry , ex gesuita , un passato;;;;;
faccia a faccia;;a;faccia;o era Giulio Andreotti , e a via Nazionale comandava Carlo Azeglio Ciampi , un  faccia a faccia non ci fu mai . Ma nei giorni scorsi i motivi di dissenso si sono realmente att;;;;;
faccia a faccia;;a;faccia;idoneità medica necessaria per farlo giocare . A oggi , allora , per il primo  faccia a faccia con il suo agente . Ne sentiremo delle belle . 16 07 1997 La minaccia : fare us;;;;;
faccia a faccia;;a;faccia;i inglesi ed americani procedendo per gradi . Gestendo praticamente da solo il  faccia a faccia con i suoi colleghi , prima ha raccolto il consenso di tutti sulla priorità str;;;;;
faccia a faccia;;a;faccia;nista , Armando Cossutta , rispondendo a una domanda di Bruno Vespa durante un  faccia a faccia con Walter Veltroni alla Festa di Liberazione , allo stadio Flaminio . Cossutta;;;;;
faccia a faccia;;a;faccia;a e forse è stato colpito da una ginocchiata , ma senza volerlo . Ma Mulas nel  faccia a faccia non ha mollato di un millimetro . E lo stesso ha fatto subito dopo , nel contro;;;;;
faccia a faccia;;a;faccia;Moni Ovadia - massimo interprete della musica e della comicità yiddish - e un  faccia a faccia con David Riondino il 6 luglio , prima_del concerto che lo stesso Riondino terr;;;;;
faccia a faccia;;a;faccia;orso San Maurizio . 28 05 1997 Fini : sì , ma voglio le primarie . Decisivo il  faccia a faccia tra Cavaliere e leader pds Premier , Berlusconi apre a D ' Alema Spesa sociale;;;;;
faccia a faccia;;a;faccia;. Berlusconi torna a Roma dopo la convalescenza e subito apre a D ' Alema . Il  faccia a faccia tra Cavaliere e leader pds sembra rasserenare il clima politico , creando le co;;;;;
faccia a faccia;;a;faccia;in_cambio_delle primarie D ' Alema - Berlusconi , l ' ultimo incontro Oggi il  faccia a faccia per salvare la Bicamerale ROMA . È un casino . Sarà pure poco ortodossa , ma l;;;;;
faccia a faccia;;a;faccia;amenti - che ormai le speranze di raggiungere una soluzione sono affidate a un  faccia a faccia tra i due protagonisti della politica italiana : Massimo D ' Alema e Silvio Ber;;;;;
faccia a faccia;;a;faccia;mangiato player MONACO . Bettega e Paulo Sousa a muso duro in tv . Il polemico  faccia a faccia , l ' altra sera durante un programma dedicato alla Champions League . Risponde;;;;;
faccia a faccia;;a;faccia;pre di_più la Juve allo scudetto viene accompagnata da una nuova polemica . Il  faccia a faccia nel dopo partita fra Moggi e Pasqualin , procuratore di Del Piero , crea altri;;;;;
faccia a faccia;;a;faccia;A DAL NOSTRO INVIATO L ' assalto a San Marco finisce alle 8,30 in un grottesco  faccia a faccia tra un ufficiale siciliano dei Gis e un terrorista che parla in veneto stretto;;;;;
faccia a faccia;;a;faccia;ale di bel tempo : lo spiega il presidente dell ' Upa , Giulio Malgara , in un  faccia a faccia con il presidente dell ' Assap , Antonio Contri . E aggiunge senza lesinare sod;;;;;
faccia a faccia;;a;faccia;997 Malumore nel partito per l ' accordo con Castellani . Albertini rifiuta un  faccia a faccia con l ' avversario Bertinotti : voto libero a Milano e Trieste Cossutta : Il su;;;;;
faccia a faccia;;a;faccia;o l ' invito della trasmissione Iceberg di Telelombardia per partecipare ad un  faccia a faccia con Aldo Fumagalli ( Ulivo ) . Sostenere un ulteriore dibattito in tv sarebbe s;;;;;
faccia a faccia;;a;faccia;urante la conferenza stampa , si augura che Castellani cambi atteggiamento nei  faccia a faccia . Chiarisce : Mi è parso spaventato dalla sconfitta e dall ' attenzione con cui;;;;;
faccia a faccia;;a;faccia;entro con la lista Dini e con i socialisti . E oggi in tv va in scena il primo  faccia a faccia Costa - Castellani . Ospite : Bruno Vespa . Maurizio Tropeano 30 04 1997 Un rob;;;;;
faccia a faccia;;a;faccia;rerà attendere i ballottaggi , fra due settimane , e osservare i risultati del  faccia a faccia tra i principali candidati . Dagli exit - poll infatti emerge soprattutto incer;;;;;
Faccia a faccia;;a;faccia;E . Galleria En Plein Air . Vasco Are e Gilberto Zorio ( fino_al 10 maggio ) .  Faccia a faccia fra due artisti che condividono lo stesso spazio di lavoro , ma portano avanti;;;;;
faccia a faccia;;a;faccia;le , quando la discoteca Patio ( corso Moncalieri 346 ) ospiterà alle 15,30 un  faccia a faccia fra il pubblico e due rivelazioni sanremesi , gli ( i ? ) Jalisse e le sorellin;;;;;
faccia a faccia;;a;faccia;del pds . Suppergiù nelle stesse ore , a via del Plebiscito , Berlusconi ha un  faccia a faccia con Fini , per ridurlo a più miti consigli . È lo stesso Cavaliere a raccontare;;;;;
faccia a faccia;;a;faccia;, che non ha messo a tacere le altre polemiche della campagna : l ' esplosivo  faccia a faccia fra Neil Hamilton , il conservatore accusato di avere accettato bustarelle , e;;;;;
faccia a faccia;;a;faccia;ata circoscrizione di Neil Hamilton . Ieri il deputato inquisito ha affrontato  faccia a faccia , poche ore prima_della riunione di partito che avrebbe deciso il suo futuro ,;;;;;
faccia a faccia;;a;faccia;che implica un confronto senza ipocrisie dentro la coalizione di governo , un  faccia a faccia senza riserve . Perché la soluzione , che riguardi la missione albanese o la;;;;;
faccia a faccia;;a;faccia;definire la lista , Fumagalli ha preferito rinviare il debutto televisivo , un  faccia a faccia con Albertini condotto da Bruno Vespa . Il vero nodo , con Rifondazione , sono;;;;;
faccia a faccia;;a;faccia;nigma . E oggi , ore 18 , salvo defezioni dell ' ultima ora , ci sarà il primo  faccia a faccia fra Castellani , Costa e il leghista Comino , organizzato dall ' Associazione d;;;;;
faccia a faccia;;a;faccia;a promessa ( minaccia ? ) diventa realtà : dopo anni di proteste , dibattiti e  faccia a faccia con i dirigenti comunali buona parte dei negozianti del centro hanno deciso :;;;;;
faccia a faccia;;a;faccia;"avanti "" condannati senza prove per la strage di Bologna "" . Lo ha detto in un  faccia a faccia con il deputato verde Marco Boato per il settimanale Panorama , che ne ha antic";;;;;
faccia a faccia;;a;faccia;ngiusta . E se qualcuno pensava che con Prima serata potesse avvenire il primo  faccia a faccia tra il sindaco Castellani e il quasi candidato del Polo , Costa , è rimasto del;;;;;
faccia a faccia;;a;faccia;"lcuna proposta Comunali , cresce il "" partito d ' autunno "" E slitta ancora il  faccia a faccia Prodi - Berlusconi act , agreement ROMA . "" Anticipare la Finanziaria ? È oppor";;;;;
faccia a faccia;;a;faccia;omunità Ebraiche e delle Associazioni di Amicizia Italia - Israele . Alle 7 il  faccia a faccia con Prodi a Villa Madama , a cui è seguito il pranzo ufficiale con gli esponent;;;;;
faccia a faccia;;a;faccia;ebbero gli incontri di partito , i vertici con le segreterie , i congressi , i  faccia a faccia e i ' ' porta a porta ' ' ... . Forse ha ragione lui . Ma se si osservano i fat;;;;;
faccia a faccia;;a;faccia;a Borgoticino e Gattico erano sul luogo segnalato . I militari si sono trovati  faccia a faccia con quattro ragazzini che , come prima reazione , hanno lasciato cadere le piet;;;;;
faccia a faccia;;a;faccia;entro - sinistra . Adesso l ' interdizione non gli è riuscita . C ' è stato un  faccia a faccia tesissimo fra lui e Berlusconi , ed è stato un conflitto che ha messo a rischio;;;;;
faccia a faccia;;a;faccia;atoi ( anche gli atalantini ex compagni di Vieri ) , c ' è stato un burrascoso  faccia a faccia fra Lippi e il centravanti , durante il quale l ' allenatore avrebbe rivolto a;;;;;
faccia a faccia;;a;faccia;nelle mani dei disoccupati e poi il corteo , l ' irruzione nel Municipio , il  faccia a faccia , tesissimo , con il sindaco . Acerra , ieri mattina , primo settembre , si è r;;;;;
faccia a faccia;;a;faccia;o e gli esuberi ( Betti , Rencricca , Lo Nero e Quaresmini ) da smaltire ma il  faccia a faccia è slittato . Ieri , intanto , silenzio assoluto su De Zerbi che ieri mattina è;;;;;
