mano a mano;;a;mano;mettere ciascuno di loro in contatto con i famosi cubi ? Tirandoglieli addosso  mano a mano che entravano ? Infilandoli anche a loro nel collo della camicia ? Senti , Alfr;;;;;
mano a mano;;a;mano;pparecchio quadrato posto sotto lo schermo , e la cui lucina rossa lampeggiava  mano a mano che le immagini si succedevano . Quel marchingegno stava assorbendo i sogni del;;;;;
Mano a mano;;a;mano;rutto dalla neve e dal vento . Ogni giorno , verso mezzogiorno , va al ponte .  Mano a mano che i giorni passano , dentro_di lei comincia a crescere un senso di vuoto e ve;;;;;
Mano a mano;;a;mano;era decisamente più forte . Perciò Nanni non scappò correndo a gambe levate .  Mano a mano che passavano i minuti , Nanni vedeva gli oggetti più chiaramente . La sabbia c;;;;;
mano a mano;;a;mano;"ondei divenne prima pallido appunto come un cadavere ; poi , poco alla volta ,  mano a mano che la paura passava , l ' ira cresceva e gli fece dare inizio ad una serie di";;;;;
Mano a mano;;a;mano;pedale , talora anche senza computer , ma questa volta sí , per disperazione .  Mano a mano che procede la terapia , la velenosissima chemio , di pari passo con i migliora;;;;;
Mano a mano;;a;mano;o non sono genitori speciali e i figli Down non sono figli Down straordinari .  Mano a mano che si procede nella lettura , emerge chiaro il fatto che , nonostante tutto ,;;;;;
mano a mano;;a;mano;, godendo dei momenti belli che continuano ad esserci e affrontando i problemi  mano a mano che si presentano . Si comincia anche a guardare in modo diverso questo figlio;;;;;
mano a mano;;a;mano;usione . La via della ricerca è un po ' come l ' esperienza della reclusione :  mano a mano che si approfondisce svela nuovi aspetti che spesso risignificano globalmente i;;;;;
mano a mano;;a;mano;coadiuvato , nella fabbricazione dei chiodi , dal compagno Galieti Umberto , e  mano a mano che li fabbricavano li mettevano dentro una buca scavata sotto il banco di lavo;;;;;
Mano a mano;;a;mano;""" ) , Mahayana ( "" Grande veicolo "" ) e Vajrayana ( "" Veicolo adamantino "" ) .  Mano a mano che ci si avvicina al terzo veicolo , il linguaggio si fa più tecnico e l ' ins";;;;;
mano a mano;;a;mano;i potrebbe dire , e l ' affermazione risulterà , si spera , sempre più fondata  mano a mano che procederà questa presentazione della teoria di Kelly , che questo studioso;;;;;
mano a mano;;a;mano;che le consenta di adeguare le attività di ricerca alle esigenze che si vanno  mano a mano concretizzando . DIREZIONE V . le dell ' Università 11 - 00185 - Roma Tel. + 39;;;;;
mano a mano;;a;mano;UO ha a disposizione un suo databaseremoto sul serverdi progetto , da riempire  mano a mano che i dati sono reperiti o prodotti . Periodicamente i databasedelle UO vengono;;;;;
mano a mano;;a;mano;el prete il religioso è estraneo , ma di un ' estraneità ambigua che disegna ,  mano a mano , un segreto importante ed un passato oramai compiuto ' ' . Ora si può comprend;;;;;
mano a mano;;a;mano;ente , ma anche schiavi . Inoltre si formò una prima concezione del potere che  mano a mano andò modificandosi . Durante la dinastia Shang se ne ebbe una visione di tipo s;;;;;
mano a mano;;a;mano;he svela le sue profondità , e quindi le sue eventuali seduzioni o illusioni ,  mano a mano che l ' uomo vi si introduca per una speciale saggezza . Non è un oggetto che r;;;;;
mano a mano;;a;mano;ltri sono subalterni nella gerarchia ma essenziali nella funzione . Tuttavia ,  mano a mano che procede la riorganizzazione oligarchica e delle corporazioni , la medichess;;;;;
Mano a mano;;a;mano;"esplorazione della complessità e il definitivo riduzionismo della ricerca "" .  Mano a mano che le interrelazioni sfuggono , molte manifestazioni patologiche rimangono sen";;;;;
mano a mano;;a;mano;_se fu ritenuto possibile che Salvarezza nutrisse la speranza di rafforzarsi ,  mano a mano che il fronte si spostava a nord , con i fascisti sbandati , con le loro armi e;;;;;
mano a mano;;a;mano;ciuta , Bruges si ammira al suo specchio . Le sue rughe diventano più profonde  mano a mano che la bionda sabbia del nord si avvicina ai suoi lungofiume . Ma perché allarm;;;;;
mano a mano;;a;mano;ualmente emerse permangono ancora molti tipi tropicali in_via_di impoverimento  mano a mano che la foresta si sposta al Sud , nel miocene questa foresta permane in Egitto;;;;;
Mano a mano;;a;mano;scimento molto rapido , o molto più rapido di quello delle specie definitive .  Mano a mano che le chiome degli alberi , sviluppandosi , tendono a toccarsi si effettua un;;;;;
mano a mano;;a;mano;are ambienti ad hoc , in_grado_di sostenere corsi di durata settennale e che ,  mano a mano , verranno a sostituire quelli non deputati fin_dall ' inizio a tale scopo . In;;;;;
Mano a mano;;a;mano;nto di conservazione e nel loro culmine la civilizzazione della specie umana .  Mano a mano che la comunità degli individui diveniva la società degli individui , le consue;;;;;
mano a mano;;a;mano;uno . Varrà zero se tutti i territori hanno pari ricchezza e tenderà verso uno  mano a mano che crescono le differenze e che queste coinvolgono territori sempre più popolo;;;;;
mano a mano;;a;mano;idiarietà . Si tratta di principi che stanno avendo la loro pratica attuazione  mano a mano che , attraverso l ' emanazione di decreti legislativi , vengono precisate ed e;;;;;
mano a mano;;a;mano;ta di credito rotativo , consente di avere un conto sempre aperto estinguibile  mano a mano che si pagano le rate . Anche in questo caso , però , dovete porre attenzione a;;;;;
mano a mano;;a;mano;ivideteli a metà , eliminate il fieno e tagliateli a spicchietti . Tuffateli ,  mano a mano , in acqua con succo di limone perché non anneriscano . Prima_di cucinarli , sc;;;;;
mano a mano;;a;mano;"ni pasto , fino_all ' Epifania , con gli stessi ingredienti che vanno aggiunti  mano a mano all ' eventuale "" fondo "" rimasto . 10.12. ' 99 5099_cuc10 Bollicine per inizia";;;;;
mano a mano;;a;mano;Il diritto alla riservatezza ha trovato , infatti , nuove forme di espressione  mano a mano che dalla prassi sono emerse diverse e nuove forme di aggressione . A farsi car;;;;;
mano a mano;;a;mano;vare che il numero dei minori adottabili del Terzo Mondo è destinato a ridursi  mano a mano che verrà attuata la Convenzione dell ' Aja . Già in_base_alla legge n . 184 19;;;;;
mano a mano;;a;mano;o . Le attività che vengono svolte , in tal senso , sono numerose e differenti  mano a mano che passano i mesi . Per aprire un nido , inoltre , è necessario avere molta;;;;;
mano a mano;;a;mano;fondamentali dei modelli di socializzazione andatisi affermando e diffondendo  mano a mano in tutte le classi sociali del mondo occidentale nel secondo dopoguerra . La pr;;;;;
mano a mano;;a;mano;o una nuova disciplina , quanto piuttosto , come appare sempre più chiaramente  mano a mano che il campo delle conoscenze si estende , un modo diverso di approcciare la de;;;;;
mano a mano;;a;mano;": Forse ; ma voi lo avete detto prima_di me . LUI : Ho acquisito più sicurezza  mano a mano che imparavo il mestiere . L ' intervista è una specie di maieutica . Per far s";;;;;
mano a mano;;a;mano;ndere pressoché allo stesso modo a tutti i giornalisti che lo hanno avvicinato  mano a mano . Tomba ha occupato il posto più in alto della tribuna d ' onore , proprio acca;;;;;
mano a mano;;a;mano;"ito ? "" Effettivamente la Ferrari andava sempre migliorando , giro dopo giro ,  mano a mano che diminuiva la benzina . Era diventata molto maneggevole . Mi sono avvicinato";;;;;
mano a mano;;a;mano;elici di vedere partecipare a questo progetto , secondo modalità appropriate e  mano a mano che il processo si svolge , altre imprese e altri Paesi europei . In particolar;;;;;
mano a mano;;a;mano;ipale consigliere di Allen , un ruolo che però è diventato anche il suo limite  mano a mano che l ' astro del presidente si è offuscato . Non a caso il board di AT & T ha;;;;;
mano a mano;;a;mano;e favorirà il ridimensionamento . È opinione abbastanza largamente diffusa che  mano a mano ci si avvicinerà alle date nelle quali si prenderanno le decisioni definitive p;;;;;
mano a mano;;a;mano;quella che si sta vivendo , destinata a consolidarsi con il passare dei mesi ,  mano a mano che si avvicinerà il momento fatidico del giudizio finale che sanzionerà i paes;;;;;
mano a mano;;a;mano;ioni , suscettibili di evidenziare una persistente ed anche elevata volatilità  mano a mano che si avvicinerà il momento delle decisioni finali . Non a caso sono stati ado;;;;;
mano a mano;;a;mano;grande affresco . Certo è che la loro struttura assomiglia a un arco teso che  mano a mano sa chiudersi , per poi riprendere inarrestabile il suo movimento in tensione .;;;;;
mano a mano;;a;mano;rafia del celebre Quarto Stato di Pelizza da Volpedo . L ' approccio è forte e  mano a mano che si snoda la vicenda del tragico amore del poco di buono con la maestrina se;;;;;
mano a mano;;a;mano;zzative ' ' . Che significa abbinare i concetti principali della storia antica  mano a mano che si parla di letteratura e di filosofia greca o latina . Anche e soprattutto;;;;;
mano a mano;;a;mano;ffitto : a quell ' altezza c ' erano dei tiranti d ' acciaio . Per far prima ,  mano a mano che procedeva il lavoro , anziché scendere dal ponte e aggirare l ' ostacolo de;;;;;
mano a mano;;a;mano;iano sui dock del porto , si comporta così male da indurla in tentazione . E ,  mano a mano che procede la gigantesca festa popolare , si sfiora più volte la tragedia - ch;;;;;
Mano a mano;;a;mano;si muove . Amanti e genitori con bambini piccoli ci vanno in pellegrinaggio .  Mano a mano che si avvicinano , i battiti dei loro cuori rallentano , il respiro si rarefà;;;;;
mano a mano;;a;mano;( quindi tra 0 e 1.936,27 lire ) mentre i numeri dopo la virgola diminuiscono  mano a mano che i prezzi diventano più consistenti : ad esempio , dopo i 20 euro ( il caso;;;;;
mano a mano;;a;mano;li uffici della motorizzazione inizieranno la distribuzione delle nuove targhe  mano a mano che si esauriranno le scorte del vecchio tipo , e non potranno assegnarle a res;;;;;
mano a mano;;a;mano;"sono , però , fili di formaggio : non si spezzano all ' istante : si allentano  mano a mano "" . "" Quando partite per Lisbona ? "" , gli chiese un collega . "" Fra due giorni";;;;;
mano a mano;;a;mano;mossi partendo da uno spunto - Mario Chiesa , ricorda ? - e abbiamo proseguito  mano a mano che le notizie emergevano . Noi non abbiamo mai fatto indagini esplorative , pe;;;;;
mano a mano;;a;mano;trasmesse da insetti succhiatori di sangue si stanno spostando verso il Nord ,  mano a mano che il clima si riscalda . Basta un aumento medio di mezzo o di un grado centig;;;;;
Mano a mano;;a;mano;a indirizzo - la sede più spesso preferita dall ' ovulo fecondato è una tuba .  Mano a mano che l ' embrione si accresce , ne erode le pareti , fino_a provocarne la rottur;;;;;
mano a mano;;a;mano;utti gli anni dall ' 83 a fine ' 95. E gli altri ? Saranno pagati in seguito ,  mano a mano che gli uffici avranno i documenti a posto ( rispondiamo così al quesito di alc;;;;;
mano a mano;;a;mano;ia sia di un infortunio . INDENNIZZI Il rischio in questione , quindi , cresce  mano a mano che aumenta l ' età dell ' assicurato , dato_che gli anziani hanno maggiori pos;;;;;
mano a mano;;a;mano;fondo bilanciato ( che comprenda quindi anche azioni ) , versandovi le cedole  mano a mano maturate , che su un Pac possono essere versate anche per importi bassi e non s;;;;;
mano a mano;;a;mano;pevoli ambiguità di Herbert Markus . Eppure quei versi inesorabilmente pulsano  mano a mano che ci si inoltra nell ' espressionistica storia ( tra ombre e nebbia , direbbe;;;;;
mano a mano;;a;mano;"o di bollette , acquisto e vendita di titoli , ecc. ) in ordine di data , cioè  mano a mano che la banca procede alla contabilizzazione ; il secondo , invece , raggruppa t";;;;;
Mano a mano;;a;mano;to . Questa è la storia di un uomo che cade da un palazzo di cinquanta piani .  Mano a mano che cadendo passa da un piano all ' altro , il tizio , per farsi coraggio , si;;;;;
mano a mano;;a;mano;zza nordica della Normandia , tra le mucche pezzate e le colline basse . Poi ,  mano a mano che la verdezza s ' ignuda sotto il cielo sempre più largo della Bretagna che s;;;;;
mano a mano;;a;mano;"o determinazioni , le prove servono al giudice per decidere . Vedremo presto ,  mano a mano che il nostro "" drone "" scenderà sulle strutture del processo , come questa a ?";;;;;
mano a mano;;a;mano;rmazioni che sono chiaramente intercettabili e riconoscibili come fasulle , ma  mano a mano che l ' allenamento avanza diventa sempre più brava nella generazione delle;;;;;
mano a mano;;a;mano;, come le ricette da cucina , ma a una velocità altissima . Progressivamente ,  mano a mano che si diffonderanno applicazioni software che utilizzano tecniche di Intellige;;;;;
mano a mano;;a;mano;e deve essere preservato affinché noi possiamo ( forse illudendoci ) riempirlo  mano a mano con la nostra libertà . Il giorno che questa possibilità ( o illusione ) fosse;;;;;
mano a mano;;a;mano;' in_disparte , sentivo frasi irripetibili sul mio conto che si moltiplicavano  mano a mano che passavano i minuti . A quel punto decisi che era meglio andar via » . Così;;;;;
mano a mano;;a;mano;certamente le marcette più o meno funebri ( spesso di importazione europea ) e  mano a mano che il jazz peregrinava nelle città come Chicago e New York , ma anche Filadelf;;;;;
mano a mano;;a;mano;he demografiche , destinato a crescere anche nelle fasce d ' età più elevate ,  mano a mano che gli attuali grandi utilizzatori invecchieranno » . Turismo ( 31% ) e prodot;;;;;
mano a mano;;a;mano;ardegna , Friuli Venezia Giulia ) , piattaforme e Ong stanno già pubblicando ,  mano a mano i dati dei fondi raccolti , le altre , man mano stanno allestendo una sezione d;;;;;
mano a mano;;a;mano;il 13% dei latini , contro il 24% degli americani bianchi caucasici adulti . E  mano a mano che sale il livello di istruzione , aumenta il gap etnico . Ha un Master Degree;;;;;
passo a passo;;a;passo;à reale di autoprodurre questo formato di libro , con una pagina in cui spiego  passo a passo tutte le operazioni necessarie per realizzarne uno , quali programmi ci voglion;;;;;
passo a passo;;a;passo;rande . Nella prima si trova una ricca esposizione di fotografie che documenta  passo a passo i vari punti della cavità , ben illustrata in un rilievo gigantesco che spicca;;;;;
passo a passo;;a;passo;radotta in un programma di calcolo , che permette di riprodurre l ' evoluzione  passo a passo . All ' aumentare della complessità del sistema da simulare cresce la mole dei;;;;;
passo a passo;;a;passo;della bocca . Esami specialistici Lo sviluppo del feto può oggi essere seguito  passo a passo grazie_ad una serie di esami clinici che permettono di intervenire in tempo in;;;;;
passo a passo;;a;passo;roappezzamenti di terreno percorsi dai venti salini del mare ... Vanno seguite  passo a passo le lenticchie , salvate le piantine non più alte di una spanna dalle erbacce so;;;;;
passo a passo;;a;passo;n discorso condotto , sviluppato verso un fine , chiaro alla ragione cattivata  passo a passo , ma un segno autonomo , folgorante , irradiante , propagantesi in mille onde s;;;;;
passo a passo;;a;passo;o la pittura e la letteratura si erano impegnate a sovvertire . E con questa ,  passo a passo , è l ' insieme della logica dell ' arte rappresentativa che si trova a essere;;;;;
passo a passo;;a;passo;per tutelare la maternità ( e ancor prima , con misure preventive ) , seguendo  passo a passo la gravidanza . In certi casi intervenendo addirittura chirurgicamente sul feto;;;;;
passo a passo;;a;passo;a grugnito tutta la mattina ed ora se ne stava in silenzio guardandosi i piedi  passo a passo . - - - Non sei contento ? - - - gli chiese Teresa scuotendolo per una manica .;;;;;
passo a passo;;a;passo;lene ripropone ai suoi piccoli amici . Li conduce per un picnic ad Ala eppoi ,  passo a passo , compiaciuta per l ' ammirazione stupefatta che sprizza dai loro occhioni sgra;;;;;
passo a passo;;a;passo;Il primo segno lo si ebbe un ' ora dopo_che la nave era affondata . Rifacendo  passo a passo la via crucis che in mattinata Nenè Barbabianca aveva patito sputando sangue e;;;;;
passo a passo;;a;passo;"he mio padre si dava con la famiglia ; in realtà Giuppina si muoveva guidata ,  passo a passo , dagli effetti ingeniti alla sua natura . Come già da ragazza , ora_che si era";;;;;
passo a passo;;a;passo;lo infilai profondamente in_mezzo_al petto del signor Agenor lui indietreggiò  passo a passo e andò a cadere nella nostra porta , abbracciato alla rete . NAVE NEGRIERA La m;;;;;
passo a passo;;a;passo;rchestra mi faceva piacere , mi impegnavo a lungo sulle partiture ed esploravo  passo a passo questo mondo , imparando sempre qualcosa di nuovo . A poco a poco imparai a com;;;;;
passo a passo;;a;passo;o , rabbrividente di febbre , cominciò d ' improvviso ad annunciare gridando ,  passo a passo , tutto quanto avrebbe fatto in futuro : la presa immediata di Angostura , la s;;;;;
passo a passo;;a;passo;ere di Gauthier , in rue Gazan . Julie sapeva che quel tizio l ' aveva seguita  passo a passo , ruota nella ruota , fregandole per ogni delitto una delle auto che lei non ut;;;;;
Passo a passo;;a;passo;ero che non erano ancora mature . Entrambe tentavano di far passare il tempo .  Passo a passo , si avvicinarono al muliIlo , sul quale alcuni salici proiettavano la loro omb;;;;;
passo a passo;;a;passo;terrore , era costretta ad entrare . Distese le braccia davanti_a sé , avanzò  passo a passo e si trovò nelia parte centrale della costruzione . Ma non si vedeva niente . I;;;;;
passo a passo;;a;passo;ri_dalle grinfie dei preti , perché ti battezzano appena nato e poi ti seguono  passo a passo fino_alla morte , e può darsi anche dopo ( che rottura di palle però ! ! ! ) .;;;;;
passo a passo;;a;passo;"la loro violenza e quella dei dolori» ; durante il decorso , bisogna « seguire  passo a passo le vie che la natura imbocca» , rinforzarla se è troppo debole , ma indebolirla";;;;;
passo a passo;;a;passo;1998-1999 emerge che la combinazione delle strutture terapeutiche ( assistenza  passo a passo , compreso il reinserimento ) può avere effetti positivi sulla dipendenza e sul;;;;;
passo a passo;;a;passo;"ne che vi rivolgiate a un esperto di antiquariato . "" Il suo compito è seguire  passo a passo il cliente "" spiega Ludovico Caumont dello studio Consulenza d ' arte . "" E seg";;;;;
passo a passo;;a;passo;e d ' arte , Giovanni Urbani , che il restauro del Marco Aurelio volle e seguì  passo a passo dal suo inizio , nel 1981, fino_a quando , nel 1983, si dimise dalla carica di;;;;;
passo a passo;;a;passo;esce di gara in gara . Lo stesso campione tedesco ha ammesso_che i progressi ,  passo a passo , sono consistenti . In attesa di altre modifiche in arrivo entro un paio di se;;;;;
passo a passo;;a;passo;so dire che la decisione dei giudici mi ha abbastanza sconcertato . Ho seguito  passo a passo l ' inchiesta della collega Lucia Musti e , nei primi passi , dell ' aggiunto L;;;;;
passo a passo;;a;passo;sa Eleonora Porcu , la più stretta collaboratrice di Flamigni , che ha seguito  passo a passo il concepimento e la nascita della bimba . Elena è venuta dal freddo , ma come;;;;;
passo a passo;;a;passo;e i loro sostenitori che , a Londra come a Parigi , hanno seguito Jiang Zemin  passo a passo , caricati dalla polizia , dispersi a manganellate ma decisi a non desistere ,;;;;;
passo a passo;;a;passo;mina e già sente l ' acquolina ... L ' omaccione gaio e grasso gli va dietro_a  passo a passo Oh magnifica dovizia della mensa natalizia ! L ' illustrissimo Lambicchi fa un;;;;;
passo a passo;;a;passo;e restavano in piedi sull ' asfalto . Per superare l ' incidente si procedeva  passo a passo . Udii una sirena alle mie spalle . L ' arrivo di ambulanza e polizia avrebbe b;;;;;
passo a passo;;a;passo;' troppo ostici , saltate direttamente al capitolo 11 . Da lì ci riavviciniamo  passo a passo a cose più umane . Tempo termico Nella frenesia del mescolamento termico moleco;;;;;
passo a passo;;a;passo;a le sue parti che si aprono e si chiudono nel corso stesso del mescolamento ,  passo a passo . Grandi regioni rimangono intrappolate in configurazioni che restano ordinate;;;;;
passo a passo;;a;passo;condo indiscrezioni , avrebbe seguito il voto incollato alla tv e per seguirlo  passo a passo avrebbe cancellato anche alcuni appuntamenti . Nonostante i tentativi repubblic;;;;;
Poco a poco;;a;poco;olitudine era diversa . Gli era cresciuta addosso come una pianta rampicante .  Poco a poco , li aveva avvolti e si era presa tutto lo spazio , nascondendo completamente c;;;;;
Poco a poco;;a;poco;ecenti gocce di sangue che sembra io non riesca a cancellare dalla mia vista .  Poco a poco , le parole si mettono a fuoco . Il primo paragrafo si intitola ALL ' ARRIVO :;;;;;
Poco a poco;;a;poco;nelle profondità del mare per capirle . Ma ormai non posso tirarmi indietro .  Poco a poco , sono costretta ad accettare chi sono . Una ragazza gravemente ustionata senza;;;;;
Poco a poco;;a;poco;o a gestire mezzo milione di persone che scendevano in piazza per protestare .  Poco a poco l ' Iraq è riuscito a smantellare i controlli istituiti dalle forze d ' occupaz;;;;;
Poco a poco;;a;poco;a catturare farfalle e a classificare insetti , rane , serpenti . Che bello .  Poco a poco , mi sono addentrato nel labirinto dell ' evoluzione dell ' intelligenza umana;;;;;
Poco a poco;;a;poco;bile che a dividere le loro case ci fosse solo qualche chilometro di asfalto .  Poco a poco Carlo si calmò . Milena ricominciò anche a sorridere . C ' era ancora un po ' d;;;;;
Poco a poco;;a;poco;a si rannicchiò contro_di lui . Nell ' aria aleggiava un buon odore di sesso .  Poco a poco Carlo sprofondò nei suoi pensieri . I siciliani , la borsa piena di eroina ...;;;;;
porta a porta;idiosyncratic;a;porta;"Circa il 44 per cento delle famiglie italiane acquista tramite il """;porta a porta ;""" e spende in media all'anno, per singolo acquisto, anche 650 mila lire.";sg;idiosyncratic;nominal
porta a porta;idiosyncratic;a;porta;Silenzio sulle città che hanno adottato la strategia 'Rifiuti Zero' e che puntano su tecniche alternative senza combustione come il Trattamento biologico, alla raccolta differenziata con il ';porta a porta; e alla riduzione a monte di rifiuti ed imballaggi.;sg;idiosyncratic;nominal
porta a porta;idiosyncratic;a;porta;Da ultime Savona, Alessandria e Novara, dove grazie al ';porta a porta;, arrivato al 70% di raccolta differenziata, sono stati cancellati i progetti di un inceneritore e di una discarica.;sg;idiosyncratic;nominal
porta a porta;idiosyncratic;a;porta;"Ormai l'estorsione mensile, quella alla ""Mi manda Picone"", il film di Nanni Loy, del";porta a porta;a Natale, Pasqua e Ferragosto, è una prassi da clan straccione, usata da gruppi che cercano di sopravvivere, incapaci di fare impresa.;sg;idiosyncratic;nominal
porta a porta;idiosyncratic;a;porta;"Il libro dei sogni di Silvio di Tito Boeri Una ""mobilitazione"" generale e, da affidare ai Promotori della libertà della Brambilla, il ""più grande";porta a porta;"mai realizzato in Italia ""per"" fare da megafono dell'azione del governo sul territorio"".";sg;idiosyncratic;nominal
porta a porta;idiosyncratic;a;porta;Incrementare la raccolta differenziata con il;porta a porta;, utilizzare le migliori tecnologie per trasformare il Cdr in energia.;sg;idiosyncratic;nominal
porta a porta;idiosyncratic;a;porta;Bisogna sostituirli con il;porta a porta;in tutta la città.;sg;idiosyncratic;nominal
porta a porta;idiosyncratic;a;porta;Le prime cosa da fare sono verificare i costi del;porta a porta;e assicurare un mercato ai materiali riciclati.;sg;idiosyncratic;nominal
porta a porta;idiosyncratic;a;porta;Nella mia vita ho fatto la politica tra la gente, il;porta a porta;per i voti, ho preso anche 15mila caffè in una campagna elettorale, ma mai il ruffiano.;sg;idiosyncratic;nominal
porta a porta;idiosyncratic;a;porta;"«Ogni esperienza realizzata finora nella raccolta differenziata dei rifiuti, in particolare le metodologie più intensive come il """;porta a porta;""", hanno dimostrato che i risultati si ottengono attraverso due elementi combinati: una forte campagna di comunicazione e una attenta capacità di controllo da parte del soggetto gestore o delle forze di polizia.";sg;idiosyncratic;nominal
porta a porta;idiosyncratic;a;porta;Con il;porta a porta;?;sg;idiosyncratic;nominal
porta a porta;idiosyncratic;a;porta;E il;porta a porta;da settembre raggiungerà 325mila abitanti e da gennaio 500mila.;sg;idiosyncratic;nominal
porta a porta;idiosyncratic;a;porta;Il;porta a porta;reale, con il netturbino che va nei condomini - spiega ancora Podda - e questa strana raccolta che si fa in strada, coi camioncini, con le persone che in alcune zone hanno solo un orario a disposizione, ed è ovvio che così non funziona: i cittadini vengono scoraggiati, nessuno controlla.;sg;idiosyncratic;nominal
porta a porta;idiosyncratic;a;porta;"Mi sembra un obiettivo irraggiungibile: del resto a Milano, dove il """;porta a porta;""" si fa da anni, la differenziata oggi è al 35%.";sg;idiosyncratic;nominal
porta a porta;idiosyncratic;a;porta;Mentre le vie periferiche di Milano si affannavano per avere dal comune il 30% del costo delle luminarie, il titolare di un esercizio che si trova sul naviglio da qualche anno, attuando il classico;porta a porta;tra gli esercenti della via, in meno di una settimana è riuscito a raccogliere i soldi e far fare la luminaria sul Naviglio Grande che l'Associazione di via non faceva da qualche anno.;sg;idiosyncratic;nominal
